postId,name,body
26,labore architecto quaerat tempora voluptas consequuntur animi,exercitationem eius aut ullam vero impedit similique maiores ea et in culpa possimus omnis eos labore autem quam repellendus dolores deserunt voluptatem non ullam eos accusamus
26,deleniti facere tempore et perspiciatis voluptas quis voluptatem,fugit minima voluptatem est aut sed explicabo harum dolores at qui eaque magni velit ut et nam et ut sunt excepturi repellat non commodi
26,quod est non quia doloribus quam deleniti libero,dicta sit culpa molestiae quasi at voluptate eos dolorem perferendis accusamus rerum expedita ipsum quis qui quos est deserunt rerum fuga qui aliquam in consequatur aspernatur
27,voluptas quasi sunt laboriosam,rem magnam at voluptatem aspernatur et et nostrum rerum dignissimos eum quibusdam optio quod dolores et
27,unde tenetur vero eum iusto,ullam harum consequatur est rerum est magni tenetur aperiam et repudiandae et reprehenderit dolorum enim voluptas impedit eligendi quis necessitatibus in exercitationem voluptatem qui
27,est adipisci laudantium amet rem asperiores,sunt quis iure molestias qui ipsa commodi dolore a odio qui debitis earum unde ut omnis doloremque corrupti at repellendus earum eum
27,reiciendis quo est vitae dignissimos libero ut officiis fugiat,corrupti perspiciatis eligendi et omnis tempora nobis dolores hic dolorum vitae odit reiciendis sunt odit qui
27,inventore fugiat dignissimos,sapiente nostrum dolorem odit a sed animi non architecto doloremque unde nam aut aut ut facilis et ut autem fugit minima culpa inventore non
28,et expedita est odit,cum natus qui dolorem dolorum nihil ut nam tempore modi nesciunt ipsum hic rem sunt possimus earum magnam similique aspernatur sed totam sed voluptatem iusto id iste qui
28,saepe dolore qui tempore nihil perspiciatis omnis omnis magni,reiciendis maiores id voluptas sapiente deserunt itaque ut omnis sunt necessitatibus quibusdam dolorem voluptatem harum error
28,ea optio nesciunt officia velit enim facilis commodi,dolorem suscipit adipisci ad cum totam quia fugiat vel quia dolores molestiae eos omnis officia quidem quaerat alias vel distinctio vero provident et corporis a quia ut
28,ut pariatur voluptate possimus quasi,facilis cumque nostrum dignissimos doloremque saepe quia adipisci sunt dicta dolorum quo esse culpa iste ut asperiores cum aperiam
28,consectetur tempore eum consequuntur,velit ipsa fugiat sit qui vel nesciunt sapiente repudiandae perferendis nemo eos quos perspiciatis aperiam doloremque incidunt nostrum temporibus corrupti repudiandae vitae non corporis cupiditate suscipit quod sed numquam excepturi enim labore
29,dignissimos perspiciatis voluptate quos rem qui temporibus excepturi,et ullam id eligendi rem sit occaecati et delectus in nemo aut veritatis deserunt aspernatur dolor enim voluptas quos consequatur molestiae temporibus error
29,cum dolore sit quisquam provident nostrum vitae,cumque voluptas quo eligendi sit nemo ut ut dolor et cupiditate aut et voluptatem quia aut maiores quas accusantium expedita quia beatae aut ad quis soluta id dolorum
29,velit molestiae assumenda perferendis voluptas explicabo,est quasi maiores nisi reiciendis enim dolores minus facilis laudantium dignissimos reiciendis et facere occaecati dolores et possimus et vel et aut ipsa ad
29,earum ipsum ea quas qui molestiae omnis unde,voluptatem unde consequatur natus nostrum vel ut consequatur sequi doloremque omnis dolorem maxime eaque sunt excepturi fuga qui illum et accusamus
29,magni iusto sit,assumenda nihil et sed nulla tempora porro iste possimus aut sit officia cumque totam quis tenetur qui sequi delectus aut sunt
30,est qui debitis,possimus necessitatibus quis et dicta omnis voluptatem ea est suscipit eum soluta in quia corrupti hic iusto consequatur est aut qui earum nisi officiis sed culpa
30,reiciendis et consectetur officiis beatae corrupti aperiam,nihil aspernatur consequatur voluptatem facere sed fugiat ullam beatae accusamus et fuga maxime vero omnis necessitatibus quisquam ipsum consectetur incidunt repellat voluptas error quo et ab magnam quisquam
30,iusto reprehenderit voluptatem modi,nemo corporis quidem eius aut dolores itaque rerum quo occaecati mollitia incidunt autem est saepe nulla nobis a id dolore facilis placeat molestias in fugiat aliquam excepturi
30,optio dolorem et reiciendis et recusandae quidem,veniam est distinctio nihil quia eos sed distinctio hic ut sint ducimus debitis dolorem voluptatum assumenda eveniet ea perspiciatis
30,id saepe numquam est facilis sint enim voluptas voluptatem,est non atque eligendi aspernatur quidem earum mollitia minima neque nam exercitationem provident eum maxime quo et ut illum sequi aut fuga repudiandae sapiente sed ea distinctio molestias illum consequatur libero quidem
31,ut quas facilis laborum voluptatum consequatur odio voluptate et,quos eos sint voluptatibus similique iusto perferendis omnis voluptas earum nulla cumque dolorem consequatur officiis quis consequatur aspernatur nihil ullam et enim enim unde nihil labore non ducimus
31,quod doloremque omnis,itaque veritatis explicabo quis voluptatem mollitia soluta id non doloribus nobis fuga provident nesciunt saepe molestiae praesentium laboriosam
31,dolorum et dolorem optio in provident,et cumque error pariatur quo doloribus corrupti voluptates ad voluptatem consequatur voluptas dolores pariatur at quas iste repellat et sed quasi ea maiores rerum aut earum
31,odit illo optio ea modi in,quod magni consectetur quod doloremque velit autem ipsam nisi praesentium ut laboriosam quod deleniti pariatur aliquam sint excepturi a consectetur quas eos
31,adipisci laboriosam repudiandae omnis veritatis in facere similique rem,animi asperiores modi et tenetur vel magni id iusto aliquid ad nihil dolorem dolorum aut veritatis voluptates omnis cupiditate incidunt
32,pariatur omnis in,dolorum voluptas laboriosam quisquam ab totam beatae et aut aliquid optio assumenda voluptas velit itaque quidem voluptatem tempore cupiditate in itaque sit molestiae minus dolores magni
32,aut nobis et consequatur,voluptas quia quo ad ipsum voluptatum provident ut ipsam velit dignissimos aut assumenda ut officia laudantium quibusdam sed minima
32,explicabo est molestiae aut,et qui ad vero quis quisquam omnis fuga et vel nihil minima eligendi nostrum sed deserunt rem voluptates autem quia blanditiis cum sed
32,voluptas blanditiis deserunt quia quis,deserunt deleniti officiis architecto consequatur molestiae facere dolor voluptatem velit eos fuga dolores sit quia est a deleniti hic dolor quisquam repudiandae voluptas numquam voluptatem impedit
32,sint fugit esse,non reprehenderit aut sed quos est ad voluptatum est ut est dignissimos ut dolores consequuntur debitis aspernatur consequatur est porro nulla laboriosam repellendus et nesciunt est libero placeat
33,nesciunt quidem veritatis alias odit nisi voluptatem non est,sunt totam blanditiis eum quos fugit et ab rerum nemo ut iusto architecto ut et eligendi iure placeat omnis
33,animi vitae qui aut corrupti neque culpa modi,nulla impedit porro in sed voluptatem qui voluptas et enim beatae nobis et sit ipsam aut voluptatem voluptatibus blanditiis officia quod eos omnis earum dolorem
33,omnis ducimus ab temporibus nobis porro natus deleniti,molestiae dolorem quae rem neque sapiente voluptatum nesciunt cum id rerum at blanditiis est accusantium est eos illo porro ad quod repellendus ad et labore fugit dolorum
33,eius corrupti ea,beatae aut ut autem sit officia rerum nostrum provident ratione sed dicta omnis alias commodi rerum expedita non nobis sapiente consectetur odit unde quia voluptas in nihil consequatur doloremque ullam dolorem cum
33,quia commodi molestiae assumenda provident sit incidunt laudantium,sed praesentium ducimus minima autem corporis debitis aperiam eum sit pariatur impedit placeat illo odio odit accusantium expedita quo rerum magnam
34,sint alias molestiae qui dolor vel,nam quas eaque unde dolor blanditiis cumque eaque omnis qui rerum modi sint quae numquam exercitationem atque aut praesentium ipsa sit neque qui sint aut
34,ea nam iste est repudiandae,molestiae voluptatem qui id facere nostrum quasi asperiores rerum quisquam est repellendus deleniti eos aut sed nemo non
34,quis harum voluptatem et culpa,cupiditate optio in quidem adipisci sit dolor id et tenetur quo sit odit aperiam illum optio magnam qui molestiae eligendi harum optio dolores dolor quaerat nostrum
34,dolor dolore similique tempore ducimus,unde non aliquid magni accusantium architecto et rerum autem eos explicabo et odio facilis sed rerum ex esse beatae quia
34,cupiditate labore omnis consequatur,amet id deserunt ipsam cupiditate distinctio nulla voluptatem cum possimus voluptate ipsum quidem laudantium quos nihil
35,voluptatibus qui est et,sed non beatae placeat qui libero nam eaque qui quia ut ad doloremque sequi unde quidem adipisci debitis autem velit architecto aperiam eos nihil enim dolores veritatis omnis ex
35,corporis ullam quo,nemo ullam omnis sit labore perferendis et eveniet nostrum dignissimos expedita iusto occaecati quia sit quibusdam
35,nulla accusamus saepe debitis cum,asperiores hic fugiat aut et temporibus mollitia quo quam cumque numquam labore qui illum vel provident quod pariatur natus incidunt sunt error voluptatibus vel voluptas maiores est vero possimus
35,iure praesentium ipsam,sit dolores consequatur qui voluptas sunt earum at natus alias excepturi dolores maiores pariatur at reiciendis dolor esse optio
35,autem totam velit officiis voluptates et ullam rem,culpa non ea perspiciatis exercitationem sed natus sit enim voluptatum ratione omnis consequuntur provident commodi omnis quae odio sit at tempora
36,ipsam deleniti incidunt repudiandae voluptatem maxime provident non dolores,quam culpa fugiat rerum impedit ratione vel ipsam rem commodi qui rem eum itaque officiis omnis ad
36,ab cupiditate blanditiis ea sunt,ut facilis sapiente quia repellat autem et aut delectus sint autem nulla debitis omnis consequuntur neque
36,rerum ex quam enim sunt,sit maxime fugit sequi culpa optio consequatur voluptatem dolor expedita enim iure eum reprehenderit doloremque aspernatur modi voluptatem culpa nostrum quod atque rerum sint laboriosam et
36,et iure ex rerum qui,non saepe ipsa velit sunt totam ipsum optio voluptatem nesciunt qui iste eum et deleniti ullam
36,autem tempora a iusto eum aut voluptatum,recusandae temporibus nihil non alias consequatur libero voluptatem sed soluta accusamus a qui reiciendis officiis ad quia laborum libero et rerum voluptas sed ut et
37,similique ut et non laboriosam in eligendi et,dolor iure corrupti et eligendi nesciunt voluptatum autem consequatur in sapiente dolor voluptas dolores natus iusto qui et in perferendis
37,soluta corporis excepturi consequatur perspiciatis quia voluptatem,voluptatum voluptatem nisi consequatur et omnis nobis odio neque ab enim veniam sit qui aperiam odit voluptatem facere nesciunt esse nemo
37,praesentium quod quidem optio omnis qui,tempora soluta voluptas deserunt non fugiat similique est natus enim eum error magni soluta dolores sit doloremque
37,veritatis velit quasi quo et voluptates dolore,odio saepe ad error minima itaque omnis fuga corrupti qui eaque cupiditate eum vitae laborum rerum ut reprehenderit architecto sit debitis magnam qui corrupti cum quidem commodi facere corporis
37,natus assumenda ut,deleniti non et corrupti delectus ea cupiditate at nihil fuga rerum temporibus doloribus unde sed alias ducimus perspiciatis quia debitis fuga
38,voluptas distinctio qui similique quasi voluptatem non sit,asperiores eaque error sunt ut natus et omnis expedita error iste vitae sit alias voluptas voluptatibus quia iusto quia ea enim facere est quam ex
38,maiores iste dolor itaque nemo voluptas,et enim necessitatibus velit autem magni voluptas at maxime error sunt nobis sit dolor beatae harum rerum tenetur facere pariatur et perferendis voluptas maiores nihil eaque
38,quisquam quod quia nihil animi minima facere odit est,quam magni adipisci totam ut reprehenderit ut tempore non asperiores repellendus architecto aperiam dignissimos est aut reiciendis consectetur voluptate nihil culpa at molestiae labore qui ea
38,ut iusto asperiores delectus,nostrum excepturi debitis cum architecto iusto laudantium odit aut dolor voluptatem consectetur nulla mollitia beatae autem quasi nemo repellendus ut ea et aut architecto odio cum quod optio
38,dignissimos voluptatibus libero,laudantium vero similique eum iure iste culpa praesentium molestias doloremque alias et at doloribus aperiam natus est illo quo ratione porro excepturi
39,est perferendis eos dolores maxime rerum qui,sit vero aut voluptatem soluta corrupti dolor cum nulla ipsa accusamus aut suscipit ut dicta ut nemo ut et ut sit voluptas modi illum suscipit ea debitis aut ullam harum
39,sunt veritatis quisquam est et porro nesciunt excepturi a,dolore velit autem perferendis hic tenetur quo rerum impedit error sit eaque ut ad in expedita et nesciunt sit aspernatur repudiandae
39,quia velit nostrum eligendi voluptates,laudantium consequatur sed adipisci a odit quia necessitatibus qui numquam expedita est accusantium nostrum occaecati perspiciatis molestiae nostrum atque
39,non ut sunt ut eius autem ipsa eos sapiente,aut distinctio iusto autem sit libero deleniti est soluta non perferendis illo eveniet corrupti est sint quae sed sunt voluptatem
39,tempore vel accusantium qui quidem esse ut aut,culpa voluptas quidem eos quis excepturi quasi corporis provident enim provident velit ex occaecati deleniti id aspernatur fugiat eligendi
40,totam vel saepe aut qui velit quis,eum laborum quidem omnis facere harum ducimus dolores quaerat corporis quidem aliquid quod aut aut at dolorum aspernatur reiciendis exercitationem quasi consectetur asperiores vero blanditiis dolor
40,non perspiciatis omnis facere rem,fugit ut laborum provident quos provident voluptatibus quam non sed accusantium explicabo dolore quia distinctio voluptatibus et consequatur eos qui iure minus eaque praesentium
40,quod vel enim sit quia ipsa quo dolores,est veritatis mollitia atque quas et sint et dolor et ut beatae aut magni corporis dolores voluptatibus optio molestiae enim minus est reiciendis facere voluptate rem officia doloribus ut
40,pariatur aspernatur nam atque quis,veniam eos ab voluptatem in fugiat ipsam quis officiis non qui quia ut id voluptates et a molestiae commodi quam dolorem enim soluta impedit autem nulla
40,aperiam et omnis totam,facere maxime alias aspernatur ab quibusdam necessitatibus ratione similique error enim sed minus et et provident minima voluptatibus
41,et adipisci aliquam a aperiam ut soluta,est officiis placeat id et iusto ut fugit numquam eos aut voluptas ad quia tempore qui quibusdam doloremque recusandae tempora qui
41,blanditiis vel fuga odio qui,sequi expedita quibusdam enim ipsam beatae ad eum placeat perspiciatis quis in nulla porro voluptas quia esse et quibusdam
41,ab enim adipisci laudantium impedit qui sed,eum voluptates id autem sequi qui omnis commodi veniam et laudantium aut et molestias esse asperiores et quaerat pariatur non officia voluptatibus
41,autem voluptates voluptas nihil,voluptatibus pariatur illo autem quia aut ullam laudantium quod laborum officia dicta sit consequatur quis delectus vel omnis laboriosam laborum vero ipsa voluptas
41,et reiciendis ullam quae,voluptatem accusamus delectus natus quasi aliquid porro ab id ea aut consequatur dignissimos quod et aspernatur sapiente cum corrupti pariatur veritatis unde
42,deserunt eveniet quam vitae velit,nam iusto minus expedita numquam et id quis voluptatibus minima porro facilis dolores beatae aut sit aut quia suscipit
42,asperiores sed voluptate est,nulla quos harum commodi aperiam qui et dignissimos reiciendis ut quia est corrupti itaque laboriosam debitis suscipit
42,excepturi aut libero incidunt doloremque at,enim aut doloremque mollitia provident molestiae omnis esse excepturi officiis tempora sequi molestiae veniam voluptatem recusandae omnis temporibus et deleniti laborum sed ipsa molestiae eum aut
42,repudiandae consectetur dolore,officiis qui eos voluptas laborum error sunt repellat quis nisi unde velit delectus eum molestias tempora quia ut aut consequatur cupiditate quis sint in eum voluptates
42,quibusdam provident accusamus id aut totam eligendi,praesentium odit quos et tempora eum voluptatem non non aut eaque consectetur reprehenderit in qui eos nam nemo ea eos ea nesciunt consequatur et
43,rerum voluptate dolor,odio temporibus est ut a aut commodi minima tempora eum et fuga omnis alias deleniti facere totam unde impedit voluptas et possimus consequatur necessitatibus qui velit
43,et maiores sed temporibus cumque voluptatem sunt necessitatibus in,aut vero sint ut et voluptate sunt quod velit impedit quia cupiditate dicta magni ut eos blanditiis assumenda pariatur nemo est tempore velit
43,ratione architecto in est voluptatem quibusdam et,at non dolore molestiae autem rerum id cum facilis sit necessitatibus accusamus quia officiis sint ea sit natus rerum est nemo perspiciatis ea
43,dicta deserunt tempore,nam nesciunt earum sequi dolorum et fuga sint quae architecto in et et ipsam veniam ad voluptas rerum animi illum temporibus enim rerum est
43,sint culpa cupiditate ut sit quas qui voluptas qui,esse ab est deleniti dicta non inventore veritatis cupiditate eligendi sequi excepturi assumenda a harum sint aut eaque rerum molestias id excepturi quidem aut
44,voluptatem esse sint alias,minima quaerat voluptatibus iusto earum quia nihil et minus deleniti aspernatur voluptatibus tempore sit molestias architecto velit id debitis
44,eos velit velit esse autem minima voluptas,aperiam rerum aut provident cupiditate laboriosam enim placeat aut explicabo voluptatum similique rerum eaque eligendi nobis occaecati perspiciatis sint ullam
44,voluptatem qui deserunt dolorum in voluptates similique et qui,rem qui est facilis qui voluptatem quis est veniam quam aspernatur dicta dolore id sapiente saepe consequatur enim qui impedit culpa ex qui voluptas dolor
44,qui unde recusandae omnis ut explicabo neque magni veniam,est et dolores voluptas aut molestiae nam eos saepe expedita eum ea tempore sit iure eveniet iusto enim quos quo repellendus laudantium eum fugiat aut et
44,vel autem quia in modi velit,illum ea eum quia doloremque modi ducimus voluptatum eaque aperiam accusamus eos quia sed rerum aperiam sunt quo ea veritatis natus eos deserunt voluptas ea voluptate
45,reprehenderit rem voluptatem voluptate recusandae dolore distinctio,rerum possimus asperiores non dolores maiores tenetur ab suscipit laudantium possimus ab iure distinctio assumenda iste adipisci optio est sed eligendi temporibus perferendis tempore soluta
45,rerum aliquam ducimus repudiandae perferendis,cum officiis impedit neque a sed dolorum accusamus eaque repellat natus aut commodi sint fugit consequatur corporis voluptatum dolorum sequi perspiciatis ut facilis delectus pariatur consequatur at aut temporibus facere vitae
45,accusantium aliquid consequuntur minus quae quis et autem,maiores perspiciatis quo alias doloremque illum iusto possimus impedit velit voluptatem assumenda possimus ut nesciunt eum et deleniti molestias harum excepturi
45,eum dolorum ratione vitae expedita,perferendis quae est velit ipsa autem adipisci ex rerum voluptatem occaecati velit perferendis aut tenetur deleniti eaque quasi suscipit dolorum nobis vel et aut est eos
45,occaecati et corrupti expedita,doloribus illum tempora aliquam qui perspiciatis dolorem ratione velit facere nobis et fugiat modi fugiat dolore at ducimus voluptate porro qui architecto optio unde deleniti
46,assumenda officia quam ex natus minima sint quia,provident sed similique explicabo fugiat quasi saepe voluptatem corrupti recusandae voluptas repudiandae illum tenetur mollitia sint in enim earum est
46,omnis error aut doloremque ipsum ducimus,est quo quod tempora fuga debitis eum nihil nemo nisi consequatur sequi nesciunt dolorum et cumque maxime qui consequatur mollitia dicta iusto aut vero recusandae ut dolorem provident voluptatibus suscipit sint
46,eaque expedita temporibus iure velit eligendi labore dignissimos molestiae,quibusdam dolores eveniet qui minima magni perspiciatis pariatur ullam dolor sit ex molestiae in nulla unde rerum quibusdam deleniti nisi
46,maxime veniam at,unde aliquam ipsam eaque quia laboriosam exercitationem totam illo non et dolore ipsa laborum et sapiente fugit voluptatem et debitis quia optio et minima et nostrum
46,illo dolor corrupti quia pariatur in,neque ullam eos amet ratione architecto doloribus qui est nisi occaecati unde expedita perspiciatis animi tenetur minus eveniet aspernatur eius nihil adipisci aut
47,omnis minima dicta aliquam excepturi,veritatis laudantium laboriosam ut maxime sed voluptate consequatur itaque occaecati voluptatum est ut itaque aperiam eligendi at vel minus dicta tempora nihil pariatur libero est
47,voluptatem excepturi sit et sed qui ipsum quam consequatur,ullam modi consequatur officia dolor non explicabo et eum minus dicta dolores blanditiis dolore nobis assumenda harum velit ullam et cupiditate et commodi dolor harum et sed cum reprehenderit omnis
47,qui dolores maxime autem enim repellendus culpa nostrum consequuntur,aperiam quo quis nobis error et culpa veritatis quae sapiente nobis architecto doloribus quia laboriosam est consequatur et recusandae est eius
47,natus et necessitatibus animi,itaque voluptatem voluptas velit non est rerum incidunt vitae aut labore accusantium in atque repudiandae quos necessitatibus autem ea excepturi
47,odio sed accusantium iure repudiandae officiis ut autem illo,ea iusto laboriosam sit voluptatibus magni ratione eum et minus perferendis eius rerum suscipit velit culpa ipsa ipsam aperiam est
48,cupiditate rerum voluptate quo facere repudiandae,itaque error cupiditate asperiores ut aspernatur veniam qui doloribus sit aliquid pariatur dicta deleniti qui alias dignissimos recusandae eaque repellendus est et dolorem aut non explicabo voluptas est beatae vel temporibus
48,recusandae deserunt possimus voluptatibus ipsam iste consequatur consequatur,aut culpa quis modi libero hic dolore provident officiis placeat minima vero et iste dolores aut voluptatem saepe unde vero temporibus sunt corrupti voluptate
48,voluptatem nam ducimus non molestiae,et nostrum cupiditate nobis facere et est illo consequatur harum voluptatem totam molestiae voluptas consequatur quibusdam aut modi impedit necessitatibus et nisi nesciunt adipisci
48,voluptatum debitis qui aut voluptas eos quibusdam et,esse rem ut neque magni voluptatem id qui aut ut vel autem non qui quam sit impedit quis sit illum laborum aut at vel eos nihil quo
48,est dolorem est placeat provident non nihil,necessitatibus nulla perferendis ad inventore earum delectus vitae illo sed perferendis officiis quo eligendi voluptatem animi totam perspiciatis repellat quam eum placeat est tempore facere
49,reprehenderit inventore soluta ut aliquam,quisquam asperiores voluptas modi tempore officia quod hic dolor omnis asperiores architecto aut vel odio quisquam sunt deserunt soluta illum
49,quis sit aut vero quo accusamus,dolores minus sequi laudantium excepturi deserunt rerum voluptatem pariatur harum natus sed dolore quis consectetur quod inventore laboriosam et in dolor beatae rerum quia rerum qui recusandae quo officiis fugit
49,quaerat natus illum,rem ut cumque tempore sed aperiam unde tenetur ab maiores officiis alias aut nemo veniam dolor est eum sunt a esse ratione deserunt et
49,labore temporibus ipsa at blanditiis autem,est et itaque qui laboriosam dolor ut debitis cumque et et dolor eaque enim et architecto et quia reiciendis quis
49,et rerum fuga blanditiis provident eligendi iste eos,vel nam nemo sed vitae repellat necessitatibus dolores deserunt dolorum minima quae velit et nemo sit expedita nihil consequatur autem quia maiores
50,magnam earum qui eaque sunt excepturi,quia est sed eos animi optio dolorum consequatur reiciendis exercitationem ipsum nihil omnis beatae sed corporis enim quisquam et blanditiis qui nihil
50,vel aut blanditiis magni accusamus dolor soluta,explicabo nam nihil atque sint aut qui qui rerum excepturi soluta quis et et mollitia et voluptate minima nihil sed quaerat dolor earum tempore et non est voluptatem
50,voluptatum sint dicta voluptas aut ut,assumenda aut quis repellendus nihil impedit cupiditate nemo sit sequi laudantium aut voluptas nam dolore magnam minima aspernatur vero sapiente
50,quibusdam dignissimos aperiam sint commodi,non repudiandae dicta et commodi sint dolores facere eos nesciunt autem quia placeat quaerat non culpa quasi dolores voluptas dolorum placeat non atque libero odit autem sunt
50,perferendis magnam natus exercitationem eveniet sunt,doloremque quae ratione cumque excepturi eligendi delectus maiores necessitatibus veniam fugiat exercitationem consectetur vel earum quia illo explicabo molestiae enim rem deserunt et omnis
51,veritatis sint eius,sit vero at voluptatem corporis adipisci error sit aut nihil rerum doloremque dolorum ipsum eum ut numquam sapiente ipsam nam blanditiis ut quasi facilis optio rerum qui temporibus esse excepturi eaque
51,qui alias beatae iusto omnis placeat recusandae ut,exercitationem quisquam sed eius et cum reiciendis deleniti non perspiciatis aut voluptatum deserunt sint dignissimos est sed architecto sed
51,voluptate ipsum corporis quis provident voluptatem eos asperiores,debitis dignissimos ut illum rerum voluptatem ut qui labore optio quaerat iure iste consequuntur praesentium vero blanditiis quibusdam aut
51,velit inventore et eius saepe,laboriosam voluptas aut quibusdam mollitia sunt non dolores illum fugiat ex vero nemo aperiam porro quam expedita est vel voluptatem sit voluptas consequuntur quis eligendi omnis id nisi ducimus sapiente odit quam
51,impedit et sapiente et tempore repellendus,nihil esse aut debitis nostrum mollitia similique minus aspernatur possimus omnis eaque non eveniet rerum qui iure laboriosam
