postId,name,body
1,id labore ex et quam laborum,laudantium enim quasi est quidem magnam voluptate ipsam eos tempora quo necessitatibus dolor quam autem quasi reiciendis et nam sapiente accusantium
1,quo vero reiciendis velit similique earum,est natus enim nihil est dolore omnis voluptatem numquam et omnis occaecati quod ullam at voluptatem error expedita pariatur nihil sint nostrum voluptatem reiciendis et
1,odio adipisci rerum aut animi,quia molestiae reprehenderit quasi aspernatur aut expedita occaecati aliquam eveniet laudantium omnis quibusdam delectus saepe quia accusamus maiores nam est cum et ducimus et vero voluptates excepturi deleniti ratione
1,alias odio sit,non et atque occaecati deserunt quas accusantium unde odit nobis qui voluptatem quia voluptas consequuntur itaque dolor et qui rerum deleniti ut occaecati
1,vero eaque aliquid doloribus et culpa,harum non quasi et ratione tempore iure ex voluptates in ratione harum architecto fugit inventore cupiditate voluptates magni quo et
2,et fugit eligendi deleniti quidem qui sint nihil autem,doloribus at sed quis culpa deserunt consectetur qui praesentium accusamus fugiat dicta voluptatem rerum ut voluptate autem voluptatem repellendus aspernatur dolorem in
2,repellat consequatur praesentium vel minus molestias voluptatum,maiores sed dolores similique labore et inventore et quasi temporibus esse sunt id et eos voluptatem aliquam aliquid ratione corporis molestiae mollitia quia et magnam dolor
2,et omnis dolorem,ut voluptatem corrupti velit ad voluptatem maiores et nisi velit vero accusamus maiores voluptates quia aliquid ullam eaque
2,provident id voluptas,sapiente assumenda molestiae atque adipisci laborum distinctio aperiam et ab ut omnis et occaecati aspernatur odit sit rem expedita quas enim ipsam minus
2,eaque et deleniti atque tenetur ut quo ut,voluptate iusto quis nobis reprehenderit ipsum amet nulla quia quas dolores velit et non aut quia necessitatibus nostrum quaerat nulla et accusamus nisi facilis
3,fugit labore quia mollitia quas deserunt nostrum sunt,ut dolorum nostrum id quia aut est fuga est inventore vel eligendi explicabo quis consectetur aut occaecati repellat id natus quo est ut blanditiis quia ut vel ut maiores ea
3,modi ut eos dolores illum nam dolor,expedita maiores dignissimos facilis ipsum est rem est fugit velit sequi eum odio dolores dolor totam occaecati ratione eius rem velit
3,aut inventore non pariatur sit vitae voluptatem sapiente,fuga eos qui dolor rerum inventore corporis exercitationem corporis cupiditate et deserunt recusandae est sed quis culpa eum maiores corporis et
3,et officiis id praesentium hic aut ipsa dolorem repudiandae,vel quae voluptas qui exercitationem voluptatibus unde sed minima et qui ipsam aspernatur expedita magnam laudantium et et quaerat ut qui dolorum
3,debitis magnam hic odit aut ullam nostrum tenetur,nihil ut voluptates blanditiis autem odio dicta rerum quisquam saepe et est sunt quasi nemo laudantium deserunt molestias tempora quo quia
4,perferendis temporibus delectus optio ea eum ratione dolorum,iste ut laborum aliquid velit facere itaque quo ut soluta dicta voluptate error tempore aut et sequi reiciendis dignissimos expedita consequuntur libero sed fugiat facilis
4,eos est animi quis,consequatur necessitatibus totam sed sit dolorum recusandae quae odio excepturi voluptatum harum voluptas quisquam sit ad eveniet delectus doloribus odio qui non labore
4,aut et tenetur ducimus illum aut nulla ab,veritatis voluptates necessitatibus maiores corrupti neque et exercitationem amet sit et ullam velit sit magnam laborum magni ut molestias
4,sed impedit rerum quia et et inventore unde officiis,doloribus est illo sed minima aperiam ut dignissimos accusantium tempore atque et aut molestiae magni ut accusamus voluptatem quos ut voluptates quisquam porro sed architecto ut
4,molestias expedita iste aliquid voluptates,qui harum consequatur fugiat et eligendi perferendis at molestiae commodi ducimus doloremque asperiores numquam qui ut sit dignissimos reprehenderit tempore
5,aliquid rerum mollitia qui a consectetur eum sed,deleniti aut sed molestias explicabo commodi odio ratione nesciunt voluptate doloremque est nam autem error delectus
5,porro repellendus aut tempore quis hic,qui ipsa animi nostrum praesentium voluptatibus odit qui non impedit cum qui nostrum aliquid fuga explicabo voluptatem fugit earum voluptas exercitationem temporibus dignissimos distinctio esse inventore reprehenderit quidem ut incidunt nihil necessitatibus rerum
5,quis tempora quidem nihil iste,voluptates provident repellendus iusto perspiciatis ex fugiat ut ut dolor nam aliquid et expedita voluptate sunt vitae illo rerum in quos vel eligendi enim quae fugiat est
5,in tempore eos beatae est,repudiandae repellat quia sequi est dolore explicabo nihil et et sit et et praesentium iste atque asperiores tenetur
5,autem ab ea sit alias hic provident sit,sunt aut quae laboriosam sit ut impedit adipisci harum laborum totam deleniti voluptas odit rem ea non iure distinctio ut velit doloribus et non ex
6,in deleniti sunt provident soluta ratione veniam quam praesentium,incidunt sapiente eaque dolor eos ad est molestias quas sit et nihil exercitationem at cumque ullam nihil magnam et
6,doloribus quibusdam molestiae amet illum,nisi vel quas ut laborum ratione rerum magni eum unde et voluptatem saepe voluptas corporis modi amet ipsam eos saepe porro
6,quo voluptates voluptas nisi veritatis dignissimos dolores ut officiis,voluptatem repellendus quo alias at laudantium mollitia quidem esse temporibus consequuntur vitae rerum illum id corporis sit id
6,eum distinctio amet dolor,tempora voluptatem est magnam distinctio autem est dolorem et ipsa molestiae odit rerum itaque corporis nihil nam eaque rerum error
6,quasi nulla ducimus facilis non voluptas aut,consequuntur quia voluptate assumenda et autem voluptatem reiciendis ipsum animi est provident earum aperiam sapiente ad vitae iste accusantium aperiam eius qui dolore voluptatem et
7,ex velit ut cum eius odio ad placeat,quia incidunt ut aliquid est ut rerum deleniti iure est ipsum quia ea sint et voluptatem quaerat eaque repudiandae eveniet aut
7,dolorem architecto ut pariatur quae qui suscipit,nihil ea itaque libero illo officiis quo quo dicta inventore consequatur voluptas voluptatem corporis sed necessitatibus velit tempore rerum velit et temporibus
7,voluptatum totam vel voluptate omnis,fugit harum quae vero libero unde tempore soluta eaque culpa sequi quibusdam nulla id et et necessitatibus
7,omnis nemo sunt ab autem,omnis temporibus quasi ab omnis facilis et omnis illum quae quasi aut minus iure ex rem ut reprehenderit in non fugit
7,repellendus sapiente omnis praesentium aliquam ipsum id molestiae omnis,dolor mollitia quidem facere et vel est ut ut repudiandae est quidem dolorem sed atque rem quia aut adipisci sunt
8,sit et quis,aut vero est dolor non aut excepturi dignissimos illo nisi aut quas aut magni quia nostrum provident magnam quas modi maxime voluptatem et molestiae
8,beatae veniam nemo rerum voluptate quam aspernatur,qui rem amet aut cumque maiores earum ut quia sit nam esse qui iusto aspernatur quis voluptas dolorem distinctio ex temporibus rem
8,maiores dolores expedita,unde voluptatem qui dicta vel ad aut eos error consequatur voluptatem adipisci doloribus qui est sit aut velit aut et ea ratione eveniet iure fuga
8,necessitatibus ratione aut ut delectus quae ut,atque consequatur dolorem sunt adipisci autem et voluptatibus et quae necessitatibus rerum eaque aperiam nostrum nemo eligendi sed et beatae et inventore
8,non minima omnis deleniti pariatur facere quibusdam at,quod minus alias quos perferendis labore molestias quae ut ut corporis deserunt vitae et quaerat ut et ullam unde asperiores cum voluptatem cumque
9,voluptas deleniti ut,facere repudiandae vitae ea aut sed quo ut et facere nihil ut voluptates in saepe cupiditate accusantium numquam dolores inventore sint mollitia provident
9,nam qui et,aut culpa quaerat veritatis eos debitis aut repellat eius explicabo et officiis quo sint at magni ratione et iure incidunt quo sequi quia dolorum beatae qui
9,molestias sint est voluptatem modi,voluptatem ut possimus laborum quae ut commodi delectus in et consequatur in voluptas beatae molestiae est rerum laborum et et velit sint ipsum dolorem
9,hic molestiae et fuga ea maxime quod,qui sunt commodi sint vel optio vitae quis qui non distinctio id quasi modi dicta eos nihil sit inventore est numquam officiis
9,autem illo facilis,ipsum odio harum voluptatem sunt cumque et dolores nihil laboriosam neque commodi qui est quos numquam voluptatum corporis quo in vitae similique cumque tempore
10,dignissimos et deleniti voluptate et quod,exercitationem et id quae cum omnis voluptatibus accusantium et quidem ut ipsam sint doloremque illo ex atque necessitatibus sed
10,rerum commodi est non dolor nesciunt ut,occaecati laudantium ratione non cumque earum quod non enim soluta nisi velit similique voluptatibus esse laudantium consequatur voluptatem rem eaque voluptatem aut ut et sit quam
10,consequatur animi dolorem saepe repellendus ut quo aut tenetur,illum et alias quidem magni voluptatum ab soluta ea qui saepe corrupti hic et cum repellat esse est sint vel veritatis officia consequuntur cum
10,rerum placeat quae minus iusto eligendi,id est iure occaecati quam similique enim ab repudiandae non illum expedita quam excepturi soluta qui placeat perspiciatis optio maiores non doloremque aut iusto sapiente
10,dolorum soluta quidem ex quae occaecati dicta aut doloribus,eum accusamus aut delectus architecto blanditiis quia sunt rerum harum sit quos quia aspernatur vel corrupti inventore animi dicta vel corporis
11,molestias et odio ut commodi omnis ex,perferendis omnis esse voluptate sit mollitia sed perferendis nemo nostrum qui vel quis nisi doloribus animi odio id quas
11,esse autem dolorum,et enim voluptatem totam laudantium impedit nam labore repellendus enim earum aut consectetur mollitia fugit qui repellat expedita sunt aut fugiat vel illo quos aspernatur ducimus
11,maiores alias necessitatibus aut non,a at tempore molestiae odit qui dolores molestias dolorem et laboriosam repudiandae placeat quisquam autem aperiam consectetur maiores laboriosam nostrum
11,culpa eius tempora sit consequatur neque iure deserunt,et ipsa rem ullam cum pariatur similique quia cum ipsam est sed aut inventore provident sequi commodi enim inventore assumenda aut aut tempora possimus soluta quia consequatur modi illo
11,quas pariatur quia a doloribus,perferendis eaque labore laudantium ut molestiae soluta et vero odio non corrupti error pariatur consectetur et enim nam quia voluptatum non mollitia culpa facere voluptas suscipit veniam
12,et dolorem corrupti sed molestias,cum esse odio nihil reiciendis illum quaerat est facere quia occaecati sit totam fugiat in beatae ut occaecati unde vitae nihil quidem consequatur
12,qui quidem sed,dolorem facere itaque fuga odit autem perferendis quisquam quis corrupti eius dicta repudiandae error esse itaque aut corrupti sint consequatur aliquid
12,sint minus reiciendis qui perspiciatis id,veritatis qui nihil quia reprehenderit non ullam ea iusto consectetur nam voluptas ut temporibus tempore provident error eos et nisi et voluptate
12,quis ducimus distinctio similique et illum minima ab libero,cumque molestiae officia aut fugiat nemo autem vero alias atque sed qui ratione quia repellat vel earum ea laudantium mollitia
12,expedita libero quos cum commodi ad,error eum quia voluptates alias repudiandae accusantium veritatis maiores assumenda quod impedit animi tempore veritatis animi et et officiis labore impedit blanditiis repudiandae
13,quidem itaque dolores quod laborum aliquid molestiae,deserunt cumque laudantium et et odit quia sint quia quidem quibusdam debitis fuga in tempora deleniti impedit consequatur veniam reiciendis autem porro minima
13,libero beatae consequuntur optio est hic,tempore dolorum corrupti facilis praesentium sunt iste recusandae unde quisquam similique alias consequuntur voluptates velit
13,occaecati dolor accusantium et quasi architecto aut eveniet fugiat,aut eligendi et molestiae voluptatum tempora officia nihil sit voluptatem aut deleniti quaerat consequatur eaque sapiente tempore commodi tenetur rerum qui quo
13,consequatur aut ullam voluptas dolorum voluptatum sequi et,sed illum quis ut aut culpa labore aspernatur illo dolorem quia vitae ut aut quo repellendus est omnis esse at est debitis
13,earum ea ratione numquam,qui debitis vitae ratione tempora impedit aperiam porro molestiae placeat vero laboriosam recusandae praesentium consequatur facere et itaque quidem eveniet magnam natus distinctio sapiente
14,eius nam consequuntur,necessitatibus libero occaecati vero inventore iste assumenda veritatis asperiores non sit et quia omnis facere nemo explicabo odit quo nobis porro
14,omnis consequatur natus distinctio,nulla quo itaque beatae ad officiis animi aut exercitationem voluptatum dolorem doloremque ducimus in recusandae officia consequuntur quas aspernatur dolores est esse dolores sit illo laboriosam quaerat
14,architecto ut deserunt consequatur cumque sapiente,sed magni accusantium numquam quidem omnis et voluptatem beatae quos fugit libero vel ipsa et nihil recusandae ea iste nemo qui optio sit enim ut nostrum odit
14,at aut ea iure accusantium voluptatum nihil ipsum,omnis dolor autem qui est natus autem animi nemo voluptatum aut natus accusantium iure inventore sunt ea tenetur commodi suscipit facere architecto consequatur dolorem nihil veritatis consequuntur corporis
14,eum magni accusantium labore aut cum et tenetur,omnis aliquam praesentium ad voluptatem harum aperiam dolor autem hic asperiores quisquam ipsa necessitatibus suscipit praesentium rem deserunt et facere repellendus aut sed fugit qui est
15,vel pariatur perferendis vero ab aut voluptates labore,mollitia magnam et ipsum consequatur est expedita aut rem ut ex doloremque est vitae est cumque velit recusandae numquam libero dolor fuga fugit a
15,quia sunt dolor dolor suscipit expedita quis,quisquam voluptas ut pariatur eos amet non reprehenderit voluptates numquam in est voluptatem dicta ipsa qui esse enim
15,ut quia ipsa repellat sunt et sequi aut est,nam qui possimus deserunt inventore dignissimos nihil rerum ut consequatur vel architecto tenetur recusandae voluptate numquam dignissimos aliquid ut reprehenderit voluptatibus
15,ut non illum pariatur dolor,non accusamus eum aut et est accusantium animi nesciunt distinctio ea quas quisquam sit ut voluptatem modi natus sint facilis est qui molestias recusandae nemo
15,minus laboriosam consequuntur,natus numquam enim asperiores doloremque ullam et est molestias doloribus cupiditate labore vitae aut voluptatem itaque quos quo consectetur nihil illum veniam nostrum voluptatum repudiandae ut
16,porro ut soluta repellendus similique,sunt qui consequatur similique recusandae repellendus voluptates eos et vero nostrum fugit magnam aliquam reprehenderit nobis voluptatem eos consectetur possimus et perferendis qui ea fugiat sit doloremque
16,dolores et quo omnis voluptates,eos ullam dolorem impedit labore mollitia rerum non dolores molestiae dignissimos qui maxime sed voluptate consequatur doloremque praesentium magnam odio iste quae totam aut
16,voluptas voluptas voluptatibus blanditiis,qui adipisci eveniet excepturi iusto magni et enim ducimus asperiores blanditiis nemo commodi nihil ex enim rerum vel nobis nostrum et non
16,beatae ut ad quisquam sed repellendus et,et inventore sapiente sed sunt similique fugiat officia velit doloremque illo eligendi quas sed rerum in quidem perferendis facere molestias dolore dolor voluptas nam vel quia
16,et cumque ad culpa ut eligendi non,dignissimos itaque ab et tempore odio omnis voluptatem itaque perferendis rem repellendus tenetur nesciunt velit qui cupiditate recusandae quis debitis dolores aliquam nam
17,aut non consequuntur dignissimos voluptatibus dolorem earum recusandae dolorem,illum et voluptatem quis repellendus quidem repellat reprehenderit voluptas consequatur mollitia praesentium nisi quo quod et occaecati repellendus illo eius harum explicabo doloribus officia
17,ea est non dolorum iste nihil est,officiis dolorem voluptas aliquid eveniet tempora qui ea temporibus labore accusamus sint ut sunt necessitatibus voluptatum animi cumque at reiciendis voluptatem iure aliquid et qui dolores et
17,nihil qui accusamus ratione et molestias et minus,et consequatur voluptates magnam fugit sunt repellendus nihil earum officiis aut cupiditate et distinctio laboriosam molestiae sunt dolor explicabo recusandae
17,quia voluptatibus magnam voluptatem optio vel perspiciatis,ratione ut magni voluptas explicabo natus quia consequatur nostrum aut omnis enim in qui illum aut atque laboriosam aliquid blanditiis quisquam et laborum
17,non voluptas cum est quis aut consectetur nam,quisquam incidunt dolores sint qui doloribus provident vel cupiditate deleniti alias voluptatem placeat ad ut dolorem illum unde iure quis libero neque ea et distinctio id
18,suscipit est sunt vel illum sint,eum culpa debitis sint eaque quia magni laudantium qui neque voluptas voluptatem qui molestiae vel earum est ratione excepturi sit aut explicabo et repudiandae ut perspiciatis
18,dolor asperiores autem et omnis quasi nobis,assumenda corporis architecto repudiandae omnis qui et odit perferendis velit enim et quia reiciendis sint quia voluptas quam deserunt facilis harum eligendi
18,officiis aperiam odit sint est non,laudantium corrupti atque exercitationem quae enim et veniam dicta autem perspiciatis sit dolores minima consectetur tenetur iste facere amet est neque
18,in voluptatum nostrum voluptas iure nisi rerum est placeat,quibusdam rerum quia nostrum culpa culpa est natus impedit quo rem voluptate quos rerum culpa aut ut consectetur sunt esse laudantium voluptatibus cupiditate rerum
18,eum voluptas dolores molestias odio amet repellendus,vitae cupiditate excepturi eum veniam laudantium aspernatur blanditiis aspernatur quia ut assumenda et magni enim magnam in voluptate tempora non qui voluptatem reprehenderit porro qui voluptatibus
19,repellendus est laboriosam voluptas veritatis,qui nisi at maxime deleniti quo ex quas tenetur nam deleniti aut asperiores deserunt cum ex eaque alias sit et veniam ab consequatur molestiae
19,repellendus aspernatur occaecati tempore blanditiis deleniti omnis qui distinctio,nihil necessitatibus omnis asperiores nobis praesentium quia ab debitis quo deleniti aut sequi commodi ut perspiciatis quod est magnam aliquam modi eum quos aliquid ea est
19,mollitia dolor deleniti sed iure laudantium,ut quis et id repellat labore nobis itaque quae saepe est ullam aut dolor id ut quis sunt iure voluptates expedita voluptas doloribus modi saepe autem
19,vero repudiandae voluptatem nobis,reiciendis delectus nulla quae voluptas nihil provident quia ab corporis nesciunt blanditiis quibusdam et unde et magni eligendi aperiam corrupti perspiciatis quasi neque iure voluptatibus mollitia
19,voluptatem unde quos provident ad qui sit et excepturi,at ut tenetur rem ut fuga quis ea magnam alias aut tempore fugiat laboriosam porro quia iure qui architecto est enim
20,non sit ad culpa quis,eum itaque quam laboriosam sequi ullam quos nobis omnis dignissimos nam dolores facere id suscipit aliquid culpa rerum quis
20,reiciendis culpa omnis suscipit est,est ducimus voluptate saepe iusto repudiandae recusandae et sint fugit voluptas eum itaque odit ab eos voluptas molestiae necessitatibus earum possimus voluptatem quibusdam aut illo beatae qui delectus aut officia veritatis
20,praesentium dolorem ea voluptate et,ex et expedita cum voluptatem voluptatem ab expedita quis nihil esse quo nihil perferendis dolores velit ut culpa aut dolor maxime necessitatibus voluptatem
20,laudantium delectus nam,aut quam consequatur sit et repellat maiores laborum similique voluptatem necessitatibus nihil et debitis nemo occaecati cupiditate modi dolorum quia aut
20,et sint quia dolor et est ea nulla cum,architecto dolorem ab explicabo et provident et et eos illo omnis mollitia ex aliquam atque ut ipsum nulla nihil quis voluptas aut debitis facilis
21,perspiciatis magnam ut eum autem similique explicabo expedita,ut aut maxime officia sed aliquam et magni autem veniam repudiandae nostrum odio enim eum optio aut omnis illo quasi quibusdam inventore explicabo reprehenderit dolor saepe possimus molestiae
21,officia ullam ut neque earum ipsa et fuga,aut dolorem quos ut non aliquam unde iure minima quod ullam qui fugiat molestiae tempora voluptate vel labore saepe animi et vitae numquam ipsa
21,ipsum a ut,totam eum fugiat repellendus quae beatae explicabo excepturi iusto et repellat alias iure voluptates consequatur sequi minus sed maxime unde
21,a assumenda totam,qui aperiam labore animi magnam odit est ut autem eaque ea magni quas voluptatem doloribus vel voluptatem nostrum ut debitis enim quaerat ut esse eveniet aut
21,voluptatem repellat est,ut rerum illum error at inventore ab nobis molestiae ipsa architecto temporibus non aliquam aspernatur omnis quidem aliquid consequatur non et expedita cumque voluptates ipsam quia blanditiis libero itaque sed iusto at
22,maiores placeat facere quam pariatur,dolores debitis voluptatem ab hic magnam alias qui est sunt et porro velit et repellendus occaecati est sequi quia odio deleniti illum
22,in ipsam vel id impedit possimus eos voluptate,eveniet fugit qui porro eaque dolores eos adipisci dolores ut fugit perferendis pariatur numquam et repellat occaecati atque ipsum neque
22,ut veritatis corporis placeat suscipit consequatur quaerat,at a vel sequi nostrum harum nam nihil cumque aut in dolore rerum ipsa hic ratione rerum cum ratione provident labore ad quisquam repellendus a
22,eveniet ut similique accusantium qui dignissimos,aliquid qui dolorem deserunt aperiam natus corporis eligendi neque at et sunt aut qui illum repellat qui excepturi laborum facilis aut omnis consequatur et aut optio ipsa nisi enim
22,sint est odit officiis similique aut corrupti quas autem,cum sequi in eligendi id eaque dolores accusamus dolorem eum est voluptatem quisquam tempore in voluptas enim voluptatem asperiores voluptatibus eius quo quos quasi voluptas earum ut necessitatibus
23,possimus facilis deleniti nemo atque voluptate,ullam autem et accusantium quod sequi similique soluta explicabo ipsa eius ratione quisquam sed et excepturi occaecati pariatur molestiae ut reiciendis eum voluptatem sed
23,dolore aut aspernatur est voluptate quia ipsam,ut tempora deleniti quo molestiae eveniet provident earum occaecati est nesciunt ut pariatur ipsa voluptas voluptatem aperiam qui deleniti quibusdam voluptas molestiae facilis id iusto similique tempora aut qui
23,sint quo debitis deleniti repellat,voluptatem sint quia modi accusantium alias recusandae rerum voluptatem aut sit et ut magnam voluptas rerum odio quo labore voluptatem facere consequuntur ut sit voluptatum hic distinctio
23,optio et sunt non,nihil labore qui quis dolor eveniet iste numquam porro velit incidunt laboriosam asperiores aliquam facilis in et voluptas eveniet quasi
23,occaecati dolorem eum in veniam quia quo reiciendis,laudantium tempore aut maiores laborum fugit qui suscipit hic sint officiis corrupti officiis eum optio cumque fuga sed voluptatibus similique sit consequuntur rerum commodi
24,veritatis sit tempora quasi fuga aut dolorum,quia voluptas qui assumenda nesciunt harum iusto est corrupti aperiam ut aut unde maxime consequatur eligendi veniam modi id sint rem labore saepe minus
24,incidunt quae optio quam corporis iste deleniti accusantium vero,doloribus esse necessitatibus qui eos et ut est saepe sed rerum tempore est ut quisquam et eligendi accusantium commodi non doloribus
24,quisquam laborum reiciendis aut,repudiandae aliquam maxime cupiditate consequatur id quas error repellendus totam officia dolorem beatae natus cum exercitationem asperiores dolor ea
24,minus pariatur odit,et omnis consequatur ut in suscipit et voluptatem animi at ut dolores quos aut numquam esse praesentium aut placeat nam
24,harum error sit,iusto sint recusandae placeat atque perferendis sit corporis molestiae rem dolor eius id delectus et qui sed dolorem reiciendis error ullam corporis delectus explicabo mollitia odit laborum sed itaque deserunt rem dolorem
25,deleniti quo corporis ullam magni praesentium molestiae,soluta mollitia impedit cumque nostrum tempore aut placeat repellat enim adipisci dolores aut ut ratione laboriosam necessitatibus vel et blanditiis est iste sapiente qui atque repellendus alias earum consequuntur quia quasi quia
25,nihil tempora et reiciendis modi veniam,doloribus veritatis a et quis corrupti incidunt est harum maiores impedit et beatae qui velit et aut porro sed dignissimos deserunt deleniti et eveniet voluptas ipsa pariatur rem ducimus
25,ad eos explicabo odio velit,nostrum perspiciatis doloribus explicabo soluta id libero illo iste et ab expedita error aliquam eum sint ipsum modi possimus et
25,nostrum suscipit aut consequatur magnam sunt fuga nihil,ut ut eius qui explicabo quis iste autem nulla beatae tenetur enim assumenda explicabo consequatur harum exercitationem velit itaque consectetur et possimus
25,porro et voluptate et reprehenderit,aut voluptas dolore autem reprehenderit expedita et nihil pariatur ea animi quo ullam a ea officiis corporis eius voluptatum cum mollitia dolore quaerat accusamus
26,fuga tenetur id et qui labore delectus,est qui ut tempore temporibus pariatur provident qui consequuntur laboriosam porro dignissimos quos debitis id laborum et totam aut eius sequi dolor maiores amet rerum voluptatibus quod ratione quos labore fuga sit
26,consequatur harum magnam,omnis consequatur dignissimos iure rerum odio culpa laudantium quia voluptas enim est nisi doloremque consequatur autem officiis necessitatibus beatae et et itaque animi dolor praesentium
