postId,name,body
76,est qui quos exercitationem,laboriosam quia animi ut quasi aut enim sequi numquam similique fugiat voluptatum non sed velit quod nisi id quidem magni in eveniet hic
76,similique fugiat tenetur ea incidunt numquam,voluptatum quis ipsa voluptatem saepe est illum error repellat eaque dolor quae qui eum rerum sunt quam illo voluptates fuga possimus nemo nihil distinctio
77,sint porro optio voluptatem,consequatur possimus sit itaque distinctio fugit aut quod explicabo exercitationem voluptas labore rerum porro ut in voluptas maiores tempora accusantium voluptatum et sapiente sit quas quis et veniam
77,eius itaque ut ipsa quia quis labore,eaque eius delectus molestias suscipit nulla quisquam totam vel quos et autem sed eligendi et pariatur earum molestias magnam autem placeat culpa est et qui commodi illo et
77,provident voluptas perferendis quibusdam libero,qui quaerat id repellendus aut qui maiores quidem consequatur dignissimos deleniti deserunt eveniet libero a repellat ducimus quia aut dignissimos numquam molestiae consequatur sit impedit nostrum et sunt iure
77,et et voluptas et eligendi distinctio accusantium temporibus enim,blanditiis dolor sint nulla cum quidem aliquid voluptatem perferendis dolor consequatur voluptas et ut quisquam tempora tenetur maxime minus animi qui id eum accusantium et optio et blanditiis maxime
77,qui voluptates molestias necessitatibus eos odio quo minima,sit fugiat est autem quia ipsam error ab voluptatem sed ab labore molestiae qui debitis exercitationem non et sunt officia illo possimus iste tenetur est dolores voluptas ad aspernatur nihil
78,temporibus minus debitis deleniti repellat unde eveniet,et dicta dolores sit repudiandae id harum temporibus voluptas quia blanditiis numquam a enim quae quisquam assumenda nam doloribus vel temporibus distinctio eveniet dolores
78,magnam nihil delectus dolor natus ab ea et,qui recusandae veniam sed voluptatem ullam facilis consequatur numquam ut quod aut et non alias ex quam aut quasi ipsum praesentium ut aspernatur sit
78,laudantium quibusdam blanditiis pariatur non vero deleniti a perferendis,facilis et totam voluptatibus est optio cum facilis qui aut blanditiis rerum voluptatem accusamus et omnis quasi sint
78,excepturi nam cum molestiae et totam voluptatem nisi,dolore nihil perferendis dolor hic repudiandae iste doloribus labore quaerat et molestiae dolores sit excepturi sint et eum et aut
78,temporibus aut et,dolor ratione ab repellendus aut quia reiciendis sed est alias ex odio voluptatem velit odit tempora nihil optio aperiam blanditiis labore porro id velit dolor veritatis
79,sed ratione nesciunt odit expedita,aut repellat tenetur delectus eaque est nihil consequatur quae deleniti assumenda voluptates sit sit cupiditate maiores autem suscipit sint tenetur dolor tempore dolorem dolorum alias adipisci
79,rerum officiis qui quaerat omnis dolorem iure est repudiandae,aut aut ea ut repudiandae ea assumenda laboriosam sunt qui laboriosam dicta omnis sit corporis voluptas eos amet quam quisquam officiis facilis laborum voluptatibus accusantium ab aliquid sed id doloremque
79,illo quis nostrum accusantium architecto et aliquam ratione,et quia explicabo ut hic commodi quas provident aliquam nihil vitae in voluptatem commodi vero velit optio omnis accusamus corrupti voluptatem
79,reprehenderit eos voluptatem ut,voluptatem quisquam pariatur voluptatum qui quaerat et minus ea aliquam ullam dolorem consequatur ratione at ad nemo aperiam excepturi deleniti qui numquam quis hic nostrum tempora quidem
79,excepturi esse laborum ut qui culpa,esse vel reiciendis nobis inventore vero est fugit inventore ea quo consequatur aut autem deserunt ratione et repellendus nihil quam quidem iure est nihil mollitia
80,qui eos vitae possimus reprehenderit voluptatem voluptatem repellendus,perferendis veritatis saepe voluptatem eum voluptas quis sed occaecati nostrum fugit animi omnis ratione molestias
80,quasi exercitationem molestias dolore non non sed est,ut nisi sunt perspiciatis qui doloribus quas velit molestiae atque corrupti corporis voluptatem vel ratione aperiam tempore est eos quia a voluptas
80,labore consequuntur vel qui,libero atque accusamus blanditiis minima eveniet corporis est aliquid dolores asperiores neque quibusdam quaerat error esse non qui et adipisci magni illo hic qui qui dignissimos earum
80,sunt ut eos,corrupti ut et eveniet culpa veritatis eos sequi fugiat commodi consequuntur ipsa totam voluptatem perferendis ducimus aut exercitationem magni eos mollitia quia
80,quia aut consequatur sunt iste aliquam impedit sit,natus iure velit impedit sed officiis sint molestiae non beatae illo consequatur minima sed ratione est tenetur
81,cum voluptate sint voluptas veritatis,sit delectus recusandae qui et cupiditate sed ipsum culpa et fugiat ab illo dignissimos quo est repellat dolorum neque voluptates sed sapiente ab aut rerum enim sint voluptatum
81,ut eos mollitia eum eius,et nisi fugit totam maiores voluptatibus quis ipsa sunt debitis assumenda ullam non quasi numquam ut dolores modi recusandae ut molestias magni est voluptas quibusdam corporis eius
81,architecto voluptatum eos blanditiis aliquam debitis beatae nesciunt dolorum,et a et perspiciatis autem expedita maiores dignissimos labore minus molestiae enim et ipsam ea et perspiciatis veritatis debitis maxime
81,officia qui ut explicabo eos fugit,modi est et eveniet facilis explicabo voluptatem saepe quo et sint quas quia corporis pariatur voluptatibus est iste fugiat delectus animi rerum doloribus est enim
81,incidunt commodi voluptatem maiores asperiores blanditiis omnis ratione,aut aut sit cupiditate maxime praesentium occaecati cumque vero sint sit aliquam porro quo consequuntur ut numquam qui maxime voluptas est consequatur ullam tenetur commodi qui consectetur distinctio eligendi atque
82,sint eaque rerum voluptas fugiat quia qui,dicta in quam tenetur sed molestiae a sit est aut quia autem aut nam voluptatem reiciendis corporis voluptatem sapiente est id quia explicabo enim tempora asperiores
82,eius tempora sint reprehenderit,totam ad quia non vero dolor laudantium sed temporibus quia aperiam corrupti sint accusantium eligendi aliquam rerum voluptatem delectus numquam nihil soluta qui sequi nisi voluptatum eaque voluptas animi ipsam
82,non excepturi enim est sapiente numquam repudiandae illo,suscipit quidem fugiat consequatur quo sequi nesciunt aliquam ratione possimus voluptatem sit quia repellendus libero excepturi ut temporibus
82,dicta dolor voluptate vel praesentium,provident illo quis dolor distinctio laborum eius enim suscipit quia error enim eos consequuntur est incidunt adipisci beatae tenetur excepturi in labore commodi fugiat omnis in et at nam accusamus et
82,et dolore hic a cupiditate beatae natus iusto soluta,in consequatur corporis qui a et magni eum illum corrupti veniam debitis ab iure harum enim ut assumenda cum adipisci veritatis et veniam rem eius expedita quos corrupti incidunt
83,hic rem eligendi tenetur ipsum dolore maxime eum,nam voluptatem ex aut voluptatem mollitia sit sapiente qui hic ut qui natus in iste et magnam dolores et fugit ea sint ut minima quas eum nobis at reprehenderit
83,quaerat et quia accusamus provident earum cumque,veniam non culpa aut voluptas rem eum officiis mollitia placeat eos cum consequatur eos commodi dolorem animi maiores qui
83,atque porro quo voluptas,consequatur harum est omnis qui recusandae qui voluptatem et distinctio sint eaque dolores quo dolorem asperiores aperiam non quis asperiores aut praesentium
83,ut qui voluptatem hic maxime,molestias debitis magni illo sint officiis ut quia sed tenetur dolorem soluta voluptatem fugiat voluptas molestiae magnam fuga similique enim illum voluptas aspernatur officia
83,rerum consequatur ut et voluptate harum amet accusantium est,iure vitae accusamus tenetur autem ipsa deleniti sunt laudantium ut beatae repellendus non eos ut consequuntur repudiandae ducimus enim reiciendis rem explicabo magni dolore
84,neque nemo consequatur ea fugit aut esse suscipit dolore,enim velit consequatur excepturi corporis voluptatem nostrum nesciunt alias perspiciatis corporis neque at eius porro sapiente ratione maiores natus facere molestiae vel explicabo voluptas unde
84,quia reiciendis nobis minima quia et saepe,et vitae consectetur ut voluptatem et et eveniet sit incidunt tenetur voluptatem provident occaecati exercitationem neque placeat
84,nesciunt voluptates amet sint et delectus et dolore culpa,animi est eveniet officiis qui aperiam dolore occaecati enim aut reiciendis animi ad sint labore blanditiis adipisci voluptatibus eius error omnis rerum facere architecto occaecati rerum
84,omnis voluptate dolorem similique totam,cum neque recusandae occaecati aliquam reprehenderit ullam saepe veniam quasi ea provident tenetur architecto ad cupiditate molestiae mollitia molestias debitis eveniet doloremque voluptatem aut dolore consequatur nihil facere et
84,aut recusandae a sit voluptas explicabo nam et,voluptas cum eum minima rem dolorem et nemo repellendus voluptatem sit repudiandae nulla qui recusandae nobis blanditiis perspiciatis dolor ipsam reprehenderit odio
85,non eligendi ipsam provident,voluptate libero corrupti facere totam eaque consequatur nemo enim aliquid exercitationem nulla dignissimos illo est amet non iure amet sed dolore non ipsam magni
85,sit molestiae corporis,ducimus ut ut fugiat nesciunt labore deleniti non et aut voluptatum quidem consectetur incidunt voluptas accusantium quo fuga eaque quisquam et et sapiente aut
85,assumenda iure a,rerum laborum voluptas ipsa enim praesentium quisquam aliquid perspiciatis eveniet id est est facilis atque aut facere provident reiciendis libero atque est
85,molestiae dolores itaque dicta earum eligendi dolores,ducimus hic ea velit dolorum soluta voluptas similique rerum dolorum sint maxime et vel voluptatum nesciunt et id consequatur earum sed
85,cumque expedita consequatur qui,labore necessitatibus et eum quas id ut doloribus aspernatur nostrum sapiente quo aut quia eos rerum voluptatem numquam minima soluta velit recusandae ut
86,deleniti tempora non quia et aut,reiciendis consequatur sunt atque quisquam ut sed iure consequatur laboriosam dicta odio quas cumque iure blanditiis ad sed ullam dignissimos sunt et exercitationem saepe
86,delectus illum minus odit,in laborum et distinctio nobis maxime maxime id commodi eaque enim amet qui autem debitis et porro eum dicta sapiente iusto nulla sunt voluptate excepturi sint dolorem voluptatem quae explicabo id
86,voluptas dolores dolor nisi voluptatem ratione rerum,excepturi quos omnis aliquam voluptatem iste sit unde ab quam ipsa delectus culpa rerum cum delectus impedit ut qui modi asperiores qui sapiente quia facilis in iure
86,sed omnis dolore aperiam,ab voluptatem nobis unde doloribus aut fugiat consequuntur laboriosam minima inventore sint quis delectus hic et enim sit optio consequuntur
86,sint ullam alias et at et,debitis ut maiores ut harum sed voluptas quae amet eligendi quo quidem odit atque quisquam animi ut autem est corporis et sed tempora facere corrupti magnam
87,velit incidunt ut accusantium odit maiores quaerat,voluptas minus fugiat vel est quos soluta et veniam quia incidunt unde ut laborum odio in eligendi distinctio odit repellat nesciunt consequatur blanditiis cupiditate consequatur at et
87,quod quia nihil nisi perferendis laborum blanditiis tempora eos,quam et et harum placeat minus neque quae magni inventore saepe deleniti quisquam suscipit dolorum error aliquid dolores dignissimos dolorem autem natus iste molestiae est id impedit
87,qui ea voluptatem reiciendis enim enim nisi aut,voluptatem minus asperiores quasi perspiciatis et aut blanditiis illo deserunt molestiae ab aperiam ex minima sed omnis at et repellat aut incidunt
87,doloremque eligendi quas voluptatem non quos ex,ex eum at culpa quam aliquam cupiditate et id dolorem sint quasi et quos et omnis et qui minus est quisquam non qui rerum quas molestiae tempore veniam
87,id voluptatum nulla maiores ipsa eos,reprehenderit molestias sit nemo quas culpa dolorem exercitationem eos est voluptatem dolores est fugiat dolorem eos aut quia et amet et beatae harum vitae officia quia animi dicta magnam accusantium
88,ea illo ab et maiores eaque non nobis,sit non facilis commodi sapiente officiis aut facere libero sed voluptatum eligendi veniam velit explicabo sint laborum sunt reprehenderit dolore id nobis accusamus fugit voluptatem magni dolor qui dolores ipsa
88,magni asperiores in cupiditate,suscipit ab qui eos et commodi quas ad maiores repellat laboriosam voluptatem exercitationem quibusdam ullam ratione nulla quia iste error dolorem consequatur beatae temporibus fugit
88,ullam autem aliquam,voluptas aspernatur eveniet quod id numquam dolores quia perspiciatis eum et delectus quia occaecati adipisci nihil velit accusamus esse minus aspernatur repudiandae
88,voluptates quasi minus dolorem itaque nemo,cupiditate laborum sit reprehenderit ratione est ad corporis rem pariatur enim et omnis dicta nobis molestias quo corporis et nihil sed et impedit aut quisquam natus expedita voluptate at
88,adipisci sapiente libero beatae quas eveniet,ut nam ut asperiores quis exercitationem aspernatur eligendi autem repellendus est repudiandae quisquam rerum ad explicabo suscipit deserunt eius alias aliquid eos pariatur rerum magnam provident iusto
89,nisi qui voluptates recusandae voluptas assumenda et,illum qui quis optio quasi eius dolores et non numquam et qui necessitatibus itaque magnam mollitia earum et nisi voluptate eum accusamus ea
89,sed molestias sit voluptatibus sit aut alias sunt inventore,velit ut incidunt accusantium suscipit animi officia iusto nemo omnis sunt nobis repellendus corporis consequatur distinctio dolorem
89,illum pariatur aliquam esse nisi voluptas quisquam ea,reiciendis et distinctio qui totam non aperiam voluptas veniam in dolorem pariatur itaque voluptas adipisci velit qui voluptates voluptas ut ullam veritatis repudiandae
89,incidunt aut qui quis est sit corporis pariatur qui,eligendi labore aut non modi vel facere qui accusamus qui maxime aperiam totam et non ut repudiandae eum corrupti pariatur quia necessitatibus et adipisci ipsa consequuntur enim et nihil vero
89,temporibus adipisci eveniet libero ullam,est consequuntur cumque quo dolorem at ut dolores consequatur quia voluptates reiciendis vel rerum id et
90,dicta excepturi aut est dolor ab dolores rerum,cum fugit earum vel et nulla et voluptatem et ipsam aut et nihil officia nemo eveniet accusamus nulla aut impedit veritatis praesentium
90,molestiae qui quod quo,rerum omnis voluptatem harum aliquid voluptas accusamus eius dicta animi odio non quidem voluptas tenetur nostrum deserunt laudantium culpa dolorum
90,pariatur consequatur sit commodi aliquam,odio maxime beatae ab labore rerum alias ipsa nam est nostrum et debitis aut ab molestias assumenda eaque repudiandae
90,sunt quia soluta quae sit deleniti dolor ullam veniam,dolor at accusantium eveniet in voluptatem quam et fugiat et quasi dolores sunt eligendi voluptatum id voluptas vitae quibusdam iure eum perspiciatis
90,dolorem corporis facilis et,et provident quo necessitatibus harum excepturi sed est ut sed est doloremque labore quod quia optio explicabo adipisci magnam doloribus veritatis illo aut est inventore
91,maiores ut dolores quo sapiente nisi,dolor veritatis ipsum accusamus quae voluptates sint voluptatum et harum saepe dolorem enim expedita placeat qui quidem aut et et est minus odit qui possimus qui saepe
91,quia excepturi in harum repellat consequuntur est vel qui,ratione sequi sed earum nam aut sunt quam cum qui similique consequatur et est
91,doloremque ut est eaque,quidem nisi reprehenderit eligendi fugiat et et sapiente adipisci natus nulla similique et est esse ea accusantium sunt deleniti molestiae perferendis quam animi similique ut
91,magni quos voluptatibus earum et inventore suscipit,consequatur accusamus maiores dolorem impedit repellendus voluptas rerum eum quam quia error voluptatem et dignissimos fugit qui et facilis necessitatibus dignissimos consequatur iusto nihil possimus
91,assumenda qui et aspernatur,animi qui nostrum rerum velit voluptates sit in laborum dolorum omnis ut omnis ea optio quia necessitatibus delectus molestias sapiente perferendis dolores vel excepturi expedita
92,quod voluptatem qui qui sit sed maiores fugit,sunt ipsam illum consequuntur quasi enim possimus unde qui beatae quo eligendi vel quia asperiores est quae voluptate aperiam et iste perspiciatis
92,ipsa animi saepe veritatis voluptatibus ad amet id aut,incidunt itaque enim pariatur quibusdam voluptatibus blanditiis sint error laborum voluptas sed officiis molestiae nostrum temporibus culpa aliquam sit consectetur dolores tempore id accusantium dignissimos vel
92,fugiat consectetur saepe dicta,eos hic deserunt necessitatibus sed id ut esse nam hic eveniet vitae corrupti mollitia doloremque sit ratione deleniti perspiciatis numquam est sapiente quaerat est est sit
92,nesciunt numquam alias doloremque minus ipsam optio,veniam natus aut vero et aliquam doloremque alias cupiditate non est tempore et non vel error placeat est quisquam ea non dolore aliquid non fuga expedita dicta ut quos
92,eum fugit omnis optio,qui qui deserunt expedita at provident sequi veritatis sit qui nam tempora mollitia ratione corporis vitae rerum pariatur unde deleniti ut eos ad aut non quae nisi saepe
93,perferendis nobis praesentium accusantium culpa et et,eos quidem temporibus eum est ipsa sunt illum a facere omnis suscipit dolorem voluptatem incidunt tenetur deleniti aspernatur at quis
93,assumenda quia sint,adipisci et accusantium hic deserunt voluptates consequatur omnis quod dolorem voluptatibus quis velit laboriosam mollitia illo et iure aliquam dolorem nesciunt laborum aperiam labore repellat et maxime itaque
93,cupiditate quidem corporis totam tenetur rem nesciunt et,voluptate officiis nihil laudantium sint autem adipisci aspernatur voluptas debitis nam omnis ut non eligendi aliquam vel commodi velit officiis laboriosam corporis quas aliquid aperiam autem
93,quisquam quaerat rerum dolor asperiores doloremque,consequatur aliquam illum quis facere vel voluptatem rem sint atque in nam autem impedit dolores enim soluta rem adipisci odit sint voluptas aliquam
93,est sunt est nesciunt distinctio quaerat reprehenderit in vero,ex corrupti ut pariatur voluptas illo labore non voluptates voluptas sint et est impedit cum in fugiat cumque eum id rerum error ut rerum voluptates facilis molestiae et labore voluptatem corrupti
94,impedit autem distinctio omnis ipsam voluptas eaque,aut dignissimos eos facere velit totam eaque aut voluptas ex similique ut ipsa est voluptates ut tempora quis commodi officia et consequatur cumque delectus
94,voluptas unde perferendis ut eaque dicta,deleniti fuga hic autem sed rerum non voluptate sit totam consequuntur illo quasi quod aut ducimus dolore distinctio molestias non velit quis debitis cumque voluptas
94,nam praesentium est ipsa libero aut,facilis repellendus inventore aperiam corrupti saepe culpa velit dolores sint ut aut quis voluptates iure et a neque harum quia similique sunt eum voluptatem a
94,vel eum quia esse sapiente,dolor unde numquam distinctio ducimus eum hic rerum non expedita dolores et dignissimos rerum perspiciatis et porro est minus
94,deleniti vitae alias distinctio dignissimos ab accusantium pariatur dicta,molestias incidunt eaque numquam reprehenderit rerum ut ex ad omnis porro maiores quaerat harum nihil non quasi ea asperiores quisquam sunt fugiat eos natus iure adipisci
95,nihil ad debitis rerum optio est cumque sed voluptates,quia non dolor corporis consectetur velit eos quis incidunt ut eos nesciunt repellendus voluptas voluptate sint neque doloribus est minima autem quis velit illo ea neque
95,aspernatur ex dolor optio,et necessitatibus earum qui velit id explicabo harum optio dolor dolores reprehenderit in a itaque odit esse et et id possimus est ut consequuntur velit autem iure ut
95,quaerat et excepturi autem animi fuga,quod corrupti eum quisquam rerum accusantium tempora reprehenderit qui voluptate et sunt optio et iusto nihil amet omnis labore cumque quo saepe omnis aut quia consectetur
95,natus consequatur deleniti ipsum delectus,tempora sint qui iste itaque non neque qui suscipit enim quas rerum totam impedit esse nulla praesentium natus explicabo doloremque atque maxime mollitia impedit dolorem occaecati officia in provident eos
95,cumque consequuntur excepturi consequatur consequatur est,ut in nostrum ut et incidunt et minus nulla perferendis libero delectus nulla nemo deleniti deleniti facere autem vero velit non molestiae assumenda
96,quia hic adipisci modi fuga aperiam,officia quas aut culpa eum eaque quia rem unde ea quae reiciendis omnis excepturi nemo est vel sequi accusantium tenetur at earum et rerum quisquam temporibus cupiditate
96,ut occaecati non,nulla veniam quo consequuntur ullam autem nisi error aut facere distinctio rerum quia tempore velit distinctio occaecati ducimus ratione similique doloribus
96,quo error dignissimos numquam qui nam fugit voluptates et,non similique illo quia et rem placeat reprehenderit voluptas velit officiis fugit blanditiis nihil ab deserunt ullam
96,distinctio minima error aspernatur reiciendis inventore quo,totam explicabo harum quam impedit sunt doloremque consectetur id et minima eos incidunt quibusdam omnis saepe maiores officiis eligendi alias sint est aut cumque debitis cumque hic aut ut dolorum
96,accusantium quo error repudiandae,tenetur qui ut architecto officiis voluptatem velit eos molestias incidunt eum dolorum distinctio quam et sequi consequatur nihil voluptates animi
97,recusandae dolor similique autem saepe voluptate aut vel sit,dignissimos nobis vitae corporis delectus eligendi et ut ut amet laudantium neque et quia cupiditate debitis aliquid dolorem aspernatur libero aut autem quo et
97,placeat eveniet sunt ut quis,aliquid natus voluptas doloremque fugiat ratione adipisci unde eum facilis enim omnis ipsum nobis nihil praesentium ut blanditiis voluptatem veniam tenetur fugit et distinctio aspernatur
97,a ipsa nihil sed impedit,quos aut rerum nihil est et dolores commodi voluptas voluptatem excepturi et et expedita dignissimos atque aut reprehenderit quis quo soluta
97,hic inventore sint aut,vel libero quo sit vitae id nesciunt ipsam non a aut enim itaque totam illum est cupiditate sit nam exercitationem magnam veniam
97,enim asperiores illum,soluta quia porro mollitia eos accusamus voluptatem illo perferendis earum quia quo sed ipsam in omnis cum earum tempore eos voluptatem illum doloremque corporis ipsam facere
98,et aut qui eaque porro quo quis velit rerum,iste maxime et molestiae qui aliquam doloremque earum beatae repellat in aut eum libero eos itaque pariatur exercitationem vel quam non
98,sunt omnis aliquam labore eveniet,sint delectus nesciunt ipsum et aliquid et libero aut suscipit et molestiae nemo pariatur sequi repudiandae ea placeat neque quas eveniet mollitia quae laboriosam
98,quo neque dolorem dolorum non incidunt,aut sunt recusandae laboriosam omnis asperiores et nulla ipsum rerum quis doloremque rerum optio mollitia provident sed iste aut id numquam repudiandae veritatis
98,aut quia et corporis voluptas quisquam voluptatem,et dolorem sit reprehenderit sapiente occaecati iusto sit impedit nobis ut quia maiores debitis pariatur nostrum et aut assumenda error qui deserunt laborum quaerat et
98,et eum provident maxime beatae minus et doloremque perspiciatis,minus nihil sunt dolor ipsum a illum quis quasi officiis cupiditate architecto sit consequatur ut et sed quasi quam doloremque
99,eos enim odio,natus commodi debitis cum ex rerum alias quis maxime fugiat fugit sapiente distinctio nostrum tempora possimus quod vero itaque enim accusantium perferendis fugit ut eum labore accusantium voluptas
99,consequatur alias ab fuga tenetur maiores modi,iure deleniti aut consequatur necessitatibus id atque voluptas mollitia voluptates doloremque dolorem repudiandae hic enim laboriosam consequatur velit minus
99,ut praesentium sit eos rerum tempora,est eos doloremque autem similique sint fuga atque voluptate est minus tempore quia asperiores aliquam et corporis voluptatem consequatur et eum illo aut qui molestiae et amet
99,molestias facere soluta mollitia totam dolorem commodi itaque,est illum quia alias ipsam minus ut quod vero aut magni harum quis ab minima voluptates nemo non sint quis distinctio officia ea et maxime
99,dolor ut ut aut molestiae esse et tempora numquam,pariatur occaecati ea autem at quis et dolorem similique pariatur ipsa hic et saepe itaque cumque repellendus vel et quibusdam qui aut nemo et illo qui non quod officiis aspernatur qui optio
100,et occaecati asperiores quas voluptas ipsam nostrum,neque unde voluptatem iure odio excepturi ipsam ad id ipsa sed expedita error quam voluptatem tempora necessitatibus suscipit culpa veniam porro iste vel
100,doloribus dolores ut dolores occaecati,non dolor consequatur laboriosam ut deserunt autem odit libero dolore non nesciunt qui aut est consequatur quo dolorem
100,dolores minus aut libero,aliquam pariatur suscipit fugiat eos sunt optio voluptatem eveniet rerum dignissimos quia aut beatae modi consequatur qui rerum sint veritatis deserunt est
100,excepturi sunt cum a et rerum quo voluptatibus quia,et necessitatibus tempora ipsum quaerat inventore est quasi quidem ea repudiandae laborum omnis ab reprehenderit ut ratione sit numquam culpa a rem atque aut et
100,ex eaque eum natus,perspiciatis quis doloremque veniam nisi eos velit sed id totam inventore voluptatem laborum et eveniet aut aut aut maxime quia temporibus ut omnis