postId,name,body
52,tempore distinctio quam,nemo deleniti sunt praesentium quis quam repellendus consequatur non est ex fugiat distinctio aliquam explicabo aspernatur omnis debitis sint consequatur quo autem natus veritatis
52,illum non quod vel voluptas quos,facere at voluptatem repellendus omnis perspiciatis placeat aspernatur nobis blanditiis ut deleniti quis non cumque laborum sit id ratione vel sequi facere doloremque beatae aut maxime non
52,omnis quia fugit nisi officiis aspernatur occaecati et,aut cum sint qui facere blanditiis magnam consequuntur perspiciatis harum impedit reprehenderit iste doloribus quia quo facere et explicabo aut voluptate modi dolorem rem aut nobis ut ad voluptatum ipsum eos maxime
52,animi minima ducimus tempore officiis qui,itaque occaecati non aspernatur velit repudiandae sit rerum esse quibusdam unde molestias explicabo dolorem vero consequatur quis et libero voluptatem totam vel sapiente autem dolorum consequuntur
52,qui dolore delectus et omnis quia,aliquid molestias nemo aut est maxime laboriosam et consequatur laudantium commodi et corrupti harum quasi minima ratione sint magni sapiente ut
53,aut veritatis quasi voluptatem enim dolor soluta temporibus,sapiente qui est quod debitis qui est optio consequuntur alias hic amet ut non ad qui provident quia provident aspernatur corrupti occaecati
53,ipsa aliquid laborum quidem recusandae dolorum quia,similique harum iste ipsam non dolores facere esse et beatae error necessitatibus laboriosam fugiat culpa esse occaecati ut provident ut et dolorum nam delectus impedit aut blanditiis fugiat est unde
53,vitae voluptatem dolor iure quo non atque,debitis dolore est ut eos velit accusamus non nobis ipsa nemo quas facilis quia hic officia quam et possimus voluptas voluptatem quisquam tempore delectus
53,cum ab voluptates aut,consectetur maiores ab est qui aliquid porro ipsa labore incidunt iste deserunt quia aperiam quis sit perferendis et sint iste
53,omnis incidunt est molestias,et quibusdam saepe labore delectus et earum quis perferendis laborum soluta veritatis ea veritatis quidem accusantium est aut porro rerum quia est consequatur voluptatem numquam laudantium repellendus
54,eum enim provident atque eum,non et voluptas eaque atque esse qui molestias porro quam veniam voluptatibus minima ut velit velit ut architecto deleniti ab sint deserunt possimus quas velit et eum
54,ea commodi provident veritatis voluptatem voluptates aperiam,magnam similique animi eos explicabo natus provident cumque sit maxime velit veritatis fuga esse dolor hic nihil nesciunt assumenda aliquid vero modi alias qui quia doloribus est
54,eum et eos delectus,velit earum perspiciatis ea recusandae nihil consectetur ut maxime repellendus doloribus aperiam ut ex ratione quia esse magni ducimus rerum vel rerum officiis suscipit nihil qui
54,molestiae vitae pariatur,quos sed unde repudiandae aut porro dignissimos qui occaecati sed alias enim voluptates nesciunt sit ut adipisci est expedita quae corrupti
54,rerum adipisci et ut sit sit dolores,quas placeat repudiandae a delectus facere exercitationem consectetur facilis quas sequi est mollitia est vero hic laudantium maiores quisquam itaque aut maxime ut cumque quia doloremque voluptatem
55,et et repellat quasi non ea similique,quae eaque reprehenderit suscipit facilis ut tenetur blanditiis sint occaecati accusantium expedita sed nostrum rerum sunt nam qui placeat consequatur et
55,repudiandae ut velit dignissimos enim rem dolores odit,consequuntur molestiae aut distinctio illo qui est sequi reprehenderit hic accusamus et officiis reprehenderit culpa est et numquam et eius ipsa rerum velit
55,et aperiam autem inventore nisi nulla reiciendis velit,asperiores et minus non dolor dolorem et sint et ipsam et enim quia sequi sed beatae culpa architecto nisi minima
55,et vero nostrum tempore,quos illo consectetur dolores cupiditate enim rerum dicta sequi totam aspernatur sed praesentium ipsum voluptates perspiciatis ipsa accusantium et et
55,error nulla est laudantium similique ad,error et quasi qui facilis enim eum adipisci iste ad nostrum sint corporis quam velit necessitatibus a eius doloribus optio ad qui molestiae quaerat dignissimos voluptatem culpa aliquam explicabo commodi natus
56,inventore amet ut debitis ipsam reiciendis molestiae autem sed,dolores tempora totam quas maxime voluptatem voluptas excepturi recusandae quis odio exercitationem in consectetur sed aut excepturi eligendi sint consectetur repellendus aperiam
56,dolorem aut ipsum alias ex ea quidem nostrum,nihil ratione aliquam recusandae ipsa sunt doloribus labore molestiae officia cum aliquid repudiandae et error inventore minima optio repellat aut ea et maxime alias voluptas eius
56,est pariatur similique quod voluptas et consequuntur nam molestiae,corporis perferendis dolorum error quo rerum aut odio veritatis sit deleniti aut eligendi quam doloremque aut ipsam sint doloribus id voluptatem esse reprehenderit molestiae quia voluptatem incidunt illo beatae nihil corporis eligendi iure quo
56,voluptas nihil aut dolor adipisci non,natus atque ipsum voluptatem et necessitatibus atque quia asperiores animi odit ratione quos est repellendus sit aut repudiandae animi aut cum blanditiis repudiandae saepe laborum
56,culpa minima non consequatur sit autem quas sed ipsam,perferendis fugit expedita cumque exercitationem animi fugit aut earum nihil quia illum eum dicta ut quam commodi optio
57,consequatur voluptates sed voluptatem fuga,eius voluptatem minus et aliquid perspiciatis sint unde ut similique odio ullam vitae quisquam hic ex consequatur aliquid ab nihil explicabo sint maiores aut et dolores nostrum
57,et vitae culpa corrupti,ea consequatur placeat quo omnis illum voluptatem voluptatem fugit aut dolorum recusandae ut et tenetur officia voluptas
57,iste molestiae aut hic perspiciatis sint,perspiciatis omnis eum nihil et porro facilis fuga qui deleniti id et velit adipisci fuga voluptatibus voluptatum debitis tempore dolorem atque consequatur ea perspiciatis sed qui temporibus doloremque
57,soluta omnis maiores animi veniam voluptas et totam repellendus,rem ut sed non cumque corrupti vel nam rerum autem nobis dolorem necessitatibus fugit corporis quos sint distinctio ex et animi tempore
57,non est sunt consequatur reiciendis,est accusamus facere reprehenderit corporis ad et est fugit iure nulla et doloribus reiciendis quasi autem voluptas ipsam labore et pariatur quia
58,dolore dignissimos distinctio,doloremque accusantium necessitatibus architecto ut provident quaerat iusto eius omnis fuga laborum harum totam sunt velit aut neque corporis atque
58,voluptas ad autem maxime iusto eos dolorem ducimus est,voluptatem perspiciatis voluptatum quaerat odit voluptates iure quisquam magnam voluptates ut non qui aliquam aut ut amet sit consequatur ut suscipit
58,numquam eius voluptas quibusdam soluta exercitationem,est sed illo omnis delectus aut laboriosam possimus incidunt est sunt at nemo voluptas ex ipsam voluptatibus inventore velit sit et numquam omnis accusamus in
58,voluptatem aut harum aut corporis dignissimos occaecati sequi quod,occaecati tempora unde maiores aliquid in quo libero sint quidem at est facilis ipsa facere nostrum atque harum
58,suscipit debitis eveniet nobis atque commodi quisquam,pariatur veniam repellat quisquam tempore autem et voluptatem itaque ea impedit ex molestiae placeat hic harum mollitia dolorem inventore accusantium aut quae quia rerum autem numquam nulla culpa quasi dolor
59,occaecati et dolorum,nisi dicta numquam dolor rerum sed quaerat et sed sequi doloribus libero quos temporibus blanditiis optio est tempore qui
59,consequatur et facere similique beatae explicabo eligendi consequuntur,eos officiis omnis ab laborum nulla saepe exercitationem recusandae voluptate minima voluptatem sint sunt est consequuntur dolor voluptatem odit maxime similique deserunt et quod
59,qui sint hic,fugiat dicta quasi voluptatibus ea aut est aspernatur sed corrupti harum non omnis eos eaque quos ut quia et et nisi rerum voluptates possimus quis recusandae aperiam quia esse
59,autem totam necessitatibus sit sunt minima aut quis,ut est veritatis animi quos nam sed dolor itaque omnis nostrum autem molestiae aut optio tempora ad sapiente quae voluptatem perferendis repellat
59,ullam dignissimos non aut dolore,voluptatem est aspernatur consequatur vel facere ut omnis tenetur non ea eos quibusdam error odio atque consectetur voluptatem eligendi
60,hic eum sed dolore velit cupiditate quisquam ut inventore,quasi dolorem veniam dignissimos atque voluptas iure et quidem fugit velit et quod magnam illum quia et ea est modi aut quis dolores
60,dignissimos dolor facere,eos exercitationem est ut voluptas accusamus qui velit rerum ut dolorem eaque omnis eligendi mollitia atque ea architecto dolorum delectus accusamus
60,ipsam ut labore voluptatem quis id velit sunt,molestiae accusantium a tempore occaecati qui sunt optio eos exercitationem quas eius voluptatem omnis quibusdam autem molestiae odio dolor quam laboriosam mollitia in quibusdam sunt
60,laborum asperiores nesciunt itaque,voluptatem omnis pariatur aut saepe enim qui aut illo aut sed aperiam expedita debitis tempore animi dolorem ut libero et eos unde ex
60,in dolore iusto ex molestias vero,dolorem fugit quidem animi quas quisquam reprehenderit occaecati et dolor laborum nemo sed quas unde deleniti facere eligendi placeat aliquid aspernatur commodi sunt impedit neque corrupti alias molestiae magni tempora
61,id voluptatibus voluptas occaecati quia sunt eveniet et eius,dolore maxime saepe dolor asperiores cupiditate nisi nesciunt vitae tempora ducimus vel eos perferendis fuga sequi numquam blanditiis sit sed inventore et ut possimus soluta voluptas nihil aliquid sed earum
61,quia voluptatem sunt voluptate ut ipsa,fuga aut est delectus earum optio impedit qui excepturi iusto consequatur deserunt soluta sunt et autem neque dolor ut saepe dolores assumenda ipsa eligendi
61,excepturi itaque laudantium reiciendis dolorem,sit nesciunt id vitae ut itaque sapiente neque in at consequuntur perspiciatis dicta consequatur velit facilis iste ut error sed in sequi expedita autem
61,voluptatem quidem animi sit est nemo non omnis molestiae,minus ab quis nihil quia suscipit vel perspiciatis sunt unde aut ullam quo laudantium deleniti modi rerum illo error occaecati vel officiis facere
61,non cum consequatur at nihil aut fugiat delectus quia,repellendus quae labore sunt ut praesentium fuga reiciendis quis corporis aut quis dolor facere earum exercitationem enim sunt nihil asperiores expedita eius nesciunt a sit sit
62,omnis nisi libero,ab veritatis aspernatur molestiae explicabo ea saepe molestias sequi beatae aut perferendis quaerat aut omnis illo fugiat quisquam hic doloribus maiores itaque voluptas amet dolorem blanditiis
62,id ab commodi est quis culpa,sit tenetur aut eum quasi reiciendis dignissimos non nulla repellendus ut quisquam numquam provident et repellendus eum nihil blanditiis beatae iusto sed eius sit sed doloremque exercitationem nihil
62,enim ut optio architecto dolores nemo quos,officiis ipsa exercitationem impedit dolorem repellat adipisci qui atque illum sapiente omnis et nihil esse et eum facilis aut impedit maxime ullam et dolorem
62,maiores et quisquam,impedit qui nemo reprehenderit sequi praesentium ullam veniam quaerat optio qui error aperiam qui quisquam dolor est blanditiis molestias rerum et quae quam eum odit ab quia est ut
62,sed qui atque,quae quis qui ab rerum non hic consequatur earum facilis atque quas dolore fuga ipsam nihil velit quis rerum sit nam est nulla nihil qui excepturi et
63,veritatis nulla consequatur sed cumque,officia provident libero explicabo tempora velit eligendi mollitia similique rerum sit aut consequatur ullam tenetur qui est vero rerum est et explicabo sit sunt ea exercitationem molestiae
63,libero et distinctio repudiandae voluptatem dolores,ipsa id eum dolorum et officiis saepe eos voluptatem nesciunt quos voluptas temporibus dolores ad rerum non voluptatem aut fugit
63,quia enim et,corporis quo magnam sunt rerum enim vel repudiandae suscipit corrupti ut ab qui debitis quidem adipisci distinctio voluptatibus vitae molestias incidunt laboriosam quia quidem facilis quia architecto libero illum ut dicta
63,enim voluptatem quam,sunt cupiditate commodi est pariatur incidunt quis suscipit saepe magnam amet enim quod quis neque et modi rerum asperiores consequatur reprehenderit maiores
63,maxime nulla perspiciatis ad quo quae consequatur quas,repudiandae dolores nam quas et incidunt odio dicta eum vero dolor quidem dolorem quisquam cumque molestiae neque maxime rerum deserunt nam sequi
64,totam est minima modi sapiente nobis impedit,consequatur qui doloribus et rerum debitis cum dolorem voluptate qui fuga necessitatibus quod temporibus non voluptates aut saepe molestiae
64,iusto pariatur ea,quam iste aut molestiae nesciunt modi atque quo laudantium vel tempora quam tenetur neque aut et ipsum eum nostrum enim laboriosam officia eligendi laboriosam libero ullam sit nulla voluptate in
64,vitae porro aut ex est cumque,distinctio placeat nisi repellat animi sed praesentium voluptatem placeat eos blanditiis deleniti natus eveniet dolorum quia tempore pariatur illum dolor aspernatur ratione tenetur autem ipsum fugit
64,et eos praesentium porro voluptatibus quas quidem explicabo est,occaecati quia ipsa id fugit sunt velit iure adipisci ullam inventore quidem dolorem adipisci optio quia et quis explicabo omnis ipsa quo ut voluptatem aliquam inventore minima aut tempore excepturi similique
64,fugiat eos commodi consequatur vel qui quasi,nihil consequatur dolorem voluptatem non molestiae odit eum animi ipsum omnis ut quasi voluptas sed et et qui est aut
65,rem ducimus ipsam ut est vero distinctio et,ea necessitatibus eum nesciunt corporis minus in quisquam iste recusandae qui nobis deleniti asperiores non laboriosam sunt molestiae dolore distinctio qui officiis tempora dolorem ea
65,ipsam et commodi,id molestiae doloribus omnis atque eius sunt aperiam tenetur quia natus nihil sunt veritatis recusandae quia corporis quam omnis veniam voluptas amet quidem illo deleniti
65,et aut non illo cumque pariatur laboriosam,explicabo dicta quas cum quis rerum dignissimos et magnam sit mollitia est dolor voluptas sed ipsum et tenetur recusandae quod facilis nulla amet deserunt
65,ut ut architecto vero est ipsam,ipsam eum ea distinctio ducimus saepe eos quaerat molestiae corporis aut officia qui ut perferendis itaque possimus incidunt aut quis
65,odit sit numquam rerum porro dolorem,qui vero recusandae porro esse sint doloribus impedit voluptatem commodi asperiores laudantium ut dolores praesentium distinctio magnam voluptatum aut
66,voluptatem laborum incidunt accusamus,perspiciatis vero nulla aut consequatur fuga earum aut nemo suscipit totam vitae qui at omnis aut incidunt optio dolorem voluptatem vel assumenda vero id explicabo deleniti sit corrupti sit
66,quisquam necessitatibus commodi iure eum,consequatur ut aut placeat harum quia perspiciatis unde doloribus quae non ut modi ad unde ducimus omnis nobis voluptatem atque magnam reiciendis dolorem et qui explicabo
66,temporibus ut vero quas,molestiae minima aut rerum nesciunt vitae iusto consequatur architecto assumenda dolorum non doloremque tempora possimus qui mollitia omnis vitae odit sed
66,quasi beatae sapiente voluptates quo temporibus,nulla corrupti delectus est cupiditate explicabo facere sapiente quo id quis illo culpa ut aut sit error magni atque asperiores soluta aut cumque voluptatem occaecati omnis aliquid
66,illo ab quae deleniti,dolores tenetur rerum et aliquam culpa officiis ea rem neque modi quaerat deserunt molestias minus nesciunt iusto impedit enim laborum perferendis velit minima itaque voluptatem fugiat
67,nemo cum est officia maiores sint sunt a,maxime incidunt velit quam vel fugit nostrum veritatis et ipsam nisi voluptatem voluptas cumque tempora velit et et quisquam error maiores fugit qui dolor sit doloribus
67,dicta vero voluptas hic dolorem,voluptas iste deleniti est itaque vel ea incidunt quia voluptates sapiente repellat aut consectetur vel neque tempora esse similique sed a qui nobis voluptate hic eligendi doloribus molestiae et
67,soluta dicta pariatur reiciendis,et dolor error doloremque odio quo sunt quod est ipsam assumenda in veniam illum rerum deleniti expedita voluptate hic nostrum sed dolor et qui
67,et adipisci laboriosam est modi,et voluptatibus est et aperiam quaerat voluptate eius quo nihil voluptas doloribus et ea tempore labore non dolorem optio consequatur est id quia magni voluptas enim
67,voluptatem accusantium beatae veniam voluptatem quo culpa deleniti,hic et et aspernatur voluptates voluptas ut ut id excepturi eligendi aspernatur nulla dicta ab suscipit quis distinctio nihil temporibus unde quasi expedita et inventore consequatur rerum ab
68,eveniet eligendi nisi sunt a error blanditiis et ea,similique autem voluptatem ab et et odio animi repellendus libero voluptas voluptas quia libero facere saepe nobis consequatur et qui non hic ea maxime nihil
68,beatae esse tenetur aut est,est ut aut ut omnis distinctio illum quisquam pariatur qui aspernatur vitae dolor explicabo architecto veritatis ipsa et aut est molestiae ducimus et sapiente error sed omnis
68,qui sit quo est ipsam minima neque nobis,maiores totam quo atque explicabo perferendis iste facilis odio ab eius consequatur sit praesentium ea vitae optio minus voluptate necessitatibus omnis itaque omnis qui
68,accusantium et sit nihil quibusdam voluptatum provident est qui,dicta dolorem veniam ipsa harum minus sequi omnis quia voluptatem autem est optio doloribus repellendus id commodi quas exercitationem eum et eum dignissimos accusamus est eaque doloremque
68,rerum et quae tenetur soluta voluptatem tempore laborum enim,est aut consequatur error illo ut enim nihil fuga suscipit inventore officiis iure earum pariatur temporibus in aperiam qui quod vel necessitatibus velit eos exercitationem culpa
69,sunt ut voluptatem cupiditate maxime dolores eligendi,iure ea ea neque est esse ab sed hic et ullam sed sequi a non hic tenetur sunt enim ea laudantium ea natus
69,corporis at consequuntur consequatur,quis beatae qui sequi dicta quas et dolor non enim aspernatur excepturi aut rerum asperiores aliquid animi nulla ea tempore esse
69,repellat sed consequatur suscipit aliquam,ea alias eos et corrupti voluptatem ab incidunt voluptatibus voluptas ea nesciunt totam corporis dolor recusandae voluptas harum
69,blanditiis rerum voluptatem quaerat modi saepe ratione assumenda qui,iusto nihil quae rerum laborum recusandae voluptatem et necessitatibus ut deserunt cumque qui qui non et et eos adipisci cupiditate dolor sed voluptates maiores commodi eveniet consequuntur
69,ut deleniti autem ullam quod provident ducimus enim explicabo,omnis et fugit eos sint saepe ipsam unde est dolores sit sit assumenda laboriosam dolor deleniti voluptatem id nesciunt et placeat dolorem cumque laboriosam sunt non
70,beatae in fuga assumenda dolorem accusantium blanditiis mollitia,quas non magnam quia veritatis assumenda reiciendis similique dolores est ab praesentium fuga ut
70,tenetur id delectus recusandae voluptates quo aut,consectetur illo corporis sit labore optio quod qui occaecati aut sequi quia officiis quia aut odio quo ad rerum tenetur aut quasi veniam
70,molestias natus autem quae sint qui,perferendis dignissimos soluta ut provident sit et delectus ratione ad sapiente qui excepturi error qui quo quo illo commodi rerum maxime voluptas voluptatem
70,odio maiores a porro dolorum ut pariatur inventore,dicta impedit non et laborum laudantium qui eaque et beatae suscipit sequi magnam rem dolorem non quia vel adipisci corrupti officiis laudantium impedit
70,eius quia pariatur,eaque rerum tempore distinctio consequatur fugiat veniam et incidunt ut ut et consequatur blanditiis magnam doloremque voluptate ut architecto facere in dolorem et aut
71,quia ex perspiciatis sunt voluptatem quidem,quo nisi impedit velit repellendus esse itaque ut saepe voluptatibus occaecati ab eaque dolores maxime alias velit ducimus placeat sit laudantium quia corrupti doloremque ut
71,sit ipsam voluptatem velit,dolorem eius voluptatem vitae aliquid unde labore est molestiae labore dolorem beatae voluptatem soluta eum eos dolore et ea quasi aut doloribus sint vel suscipit tempora delectus soluta
71,consequatur reprehenderit similique vitae dolor debitis,nemo aut laborum expedita nisi sed illum ab asperiores provident a sunt recusandae ut rerum itaque est voluptatibus nihil esse ipsum et repellendus nobis rerum voluptas et
71,eligendi tempora eum deserunt,delectus est consequatur at excepturi asperiores dolor nesciunt ad id non aut ad ut non et voluptatem
71,reiciendis ad ea,vel cumque labore vitae quisquam magnam sequi ut molestiae dolores vel minus aut quas repellat nostrum fugit molestiae veritatis sequi vel quidem in molestiae id doloribus sed
72,qui vel id qui est,fugiat dolore voluptas tempore aspernatur quibusdam rem iste sit fugiat nesciunt consequatur dolor sed odit similique minima corporis quae in adipisci impedit dolores et cupiditate accusantium perferendis dignissimos error
72,consectetur totam fugit et occaecati minima aliquid hic adipisci,et eos est quis quia molestiae est quasi est quos omnis aut et sit consectetur ex molestiae est sed accusamus asperiores
72,accusantium natus ex et consequuntur neque,unde ad id nemo ipsam dolorem autem quaerat perspiciatis voluptas corrupti laborum rerum est architecto eius quos aut et voluptate voluptatem atque necessitatibus voluptate fugiat aut iusto et atque
72,esse quia quidem quisquam consequatur nisi deleniti,et explicabo voluptatem ut est nihil culpa et veritatis repellendus ipsum velit qui eligendi maxime voluptatem est dicta rerum et et nemo quia eveniet aspernatur nostrum molestiae mollitia ut dolores rem fugiat
72,rerum tempore facilis ut quod sit,sit et aut recusandae corrupti nisi vero eius nulla voluptates voluptatem placeat est commodi impedit odio omnis similique debitis et in molestiae omnis sed non magni
73,voluptates qui et corporis,cum ad porro fuga sequi dolores ipsa error magni itaque labore accusamus corporis odit consequatur quis debitis cum et voluptas facilis incidunt ut itaque dolores error
73,quia qui quia qui,excepturi omnis occaecati officiis enim saepe id non quo et dignissimos voluptates ipsum molestias facere dolorem qui iure similique corrupti neque ducimus sit alias dolor earum autem doloribus consequatur
73,nihil consequatur quibusdam,est magni totam est et enim nam voluptas veritatis est sint doloremque incidunt et cum a et eligendi nobis ratione delectus
73,vel architecto assumenda et maiores,architecto quo enim ad et reprehenderit laboriosam quia commodi officia iusto dolorem totam consequuntur cupiditate veritatis voluptates aspernatur earum saepe et sed consequatur
73,aliquam officiis omnis,modi sed aut quidem quisquam optio est aut facilis sit quia quis facere quod fugiat recusandae ex et quisquam ipsum sed sit exercitationem quia recusandae dolorem quasi iusto ipsa qui et
74,aperiam ut deserunt minus quo dicta nisi,explicabo perspiciatis quae sit qui nulla incidunt facilis repudiandae perspiciatis voluptate expedita sunt consectetur quasi id occaecati nesciunt dolorem aliquid perspiciatis repellat inventore esse ut possimus exercitationem facere modi
74,praesentium eos quam eius optio eveniet,nostrum modi et et dolores maxime facere alias doloribus eaque expedita et similique voluptatum magnam est omnis eos voluptatem et unde fugit voluptatem asperiores
74,fugiat aliquid sint,est dolor eveniet est minus eveniet recusandae iure quo aut eos ut sed ipsa harum earum aut nesciunt non dolores
74,qui incidunt vel iusto eligendi amet quia qui,qui fugit accusamus et quo minus cumque hic adipisci odio blanditiis omnis et est architecto et facilis inventore quasi provident quaerat ex rem
74,libero vero voluptatum sed facilis quos aut reprehenderit ad,beatae hic est et deserunt eius corrupti quam ut commodi sit modi est corporis animi harum ut est aperiam non fugit excepturi quo tenetur totam
75,ut quia sequi sed eius voluptas,est dicta totam architecto et minus id aut non ut et fugit eaque culpa modi repellendus aliquid qui veritatis doloribus aut consequatur voluptas sequi accusantium voluptas occaecati saepe reprehenderit ut
75,qui cumque eos consequatur fuga ut,aut illum est asperiores rerum laboriosam quis sit dolores magni minima fuga atque omnis at et quibusdam earum rem earum distinctio autem et enim dolore eos
75,nemo voluptatum quo qui atque,iure aliquid qui sit excepturi dolorem rerum possimus suscipit atque nisi labore ut aut nihil voluptatum ut aliquid praesentium assumenda tempore dolor velit ratione et corrupti
75,quam exercitationem alias totam,eligendi et consequuntur dolor nihil quaerat doloremque ut dignissimos sunt veniam non ratione esse debitis omnis similique maxime dolores tempora laborum rerum adipisci reiciendis explicabo error quidem quo necessitatibus voluptatibus vitae ipsum
75,similique doloribus odit quas magnam omnis dolorem dolore et,non ea sed reprehenderit reiciendis eaque et neque adipisci ipsa architecto deserunt ratione nesciunt tempore similique occaecati non hic vitae sit neque rerum quod dolorem ratione esse aperiam necessitatibus
76,dolorem qui architecto provident,sint qui aut aspernatur necessitatibus laboriosam autem occaecati nostrum non officiis consequuntur odit et itaque quam placeat aut molestiae saepe veniam provident
76,nemo hic sapiente placeat quidem omnis,sint fugit et id et saepe non molestiae sit earum doloremque dolorem nemo earum dignissimos ipsa soluta deleniti quos quis numquam ducimus sed corporis dolores sed quisquam suscipit
76,vitae aut perspiciatis quia enim voluptas,est molestiae non fugiat voluptatem quo porro aut praesentium ipsam aspernatur perferendis fuga officia sit ut aspernatur rerum est
